Europa Plus, Roulette, Katy Perry, за неделю, 3
Europa Plus, Туманы, Макс Барских, за неделю, 2
Europa Plus, SHTRIKHI+ID, BURITO, за неделю, 1
Europa Plus, SMALL TALK, FAKE_PICTURES, за неделю, 1
Europa Plus, I Remember The Time, Nana, за неделю, 1
Europa Plus, FIVE MORE HOURS, DEORRO, за неделю, 1
Europa Plus, TELL ME WHO, VANOTEK/ENELI, за неделю, 3
Europa Plus, THE ROAD (EFFECTIVE RADIO REMIX), FLYING_DECIBELS, за неделю, 4
Europa Plus, SHTRIKHI, BURITO, за неделю, 4
Europa Plus, LA LOUZE, SHANGUY, за неделю, 2
Europa Plus, PI_SHAPE OF YOU, Ed Sheeran, за неделю, 1
Europa Plus, I GOT LOVE, MIYAGI, за неделю, 3
Europa Plus, CALL ON ME, Starley, за неделю, 2
Europa Plus, Believer, Imagine Dragons, за неделю, 1
Europa Plus, YA OBESHAYU, NASTYA KUDRI/ALEXEY VOROBYEV, за неделю, 2
Europa Plus, PI_THIS GIRL, Kungs, за неделю, 1
Europa Plus, On My Way ft Bright Sparks, Tiesto, за неделю, 1
Europa Plus, PI_HEAR ME NOW, ALOK/BRUNO MARTINI, за неделю, 2
Europa Plus, Lets Get It Started, Black Eyed Peas, за неделю, 1
Europa Plus, I Knew You Were Trouble, Taylor Swift, за неделю, 1
Europa Plus, Thunder, Imagine Dragons, за неделю, 2
Europa Plus, LONELY TOGETHER (ALAN WARKER REMIX), AVICII/RITA ORA, за неделю, 1
Europa Plus, Whataya Want From Me, Adam Lambert, за неделю, 1
Europa Plus, Gangstas Paradise, Coolio, за неделю, 1
Europa Plus, Feel Good Inc, Gorillaz, за неделю, 1
Europa Plus, La Cancion, Tim3bomb, за неделю, 3
Europa Plus, LET ME LOVE YOU, DJ_SNAKE/JUSTIN BIEBER, за неделю, 1
Europa Plus, Disco Tits, Tove Lo, за неделю, 1
Europa Plus, MORE THAN YOU KNOW, AXWELL_and_INGROSOO, за неделю, 3
Europa Plus, Case Depart, Team BS, за неделю, 1
Europa Plus, JAI CHERCHE, AMIR, за неделю, 1
Europa Plus, Papaoutai, Stromae, за неделю, 1
Europa Plus, SAD STORY+ID, MERK_and_KREMONT, за неделю, 1
Europa Plus, SUPERGIRL, ANNA NAKLAB/ALLE FARBEN, за неделю, 1
Europa Plus, Falling, Alesso, за неделю, 3
Europa Plus, Dusk Till Dawn ft Sia, ZAYN, за неделю, 5
Europa Plus, Disco Tits, Tove Lo, за неделю, 2
Europa Plus, I Dont Wanna Know, Mario Winnans and Enya, за неделю, 1
Europa Plus, LIGHT IT UP (REMIX), MAJOR_LAZER/FUSE_ODG, за неделю, 1
Europa Plus, Hot Right Now, Dj Fresh and Rita Ora, за неделю, 1
Europa Plus, TAK KRASIVO (REMIX), SERGEY LAZAREV, за неделю, 5
Europa Plus, KATCHI, OFENBACH/NICK WATERHOUSE, за неделю, 5
Europa Plus, PI_WAY DOWN WE GO, KALEO, за неделю, 4
Europa Plus, Улети, T-Fest, за неделю, 5
Europa Plus, SWISH SWISH, KATY PERRY/NICKI MINAJ, за неделю, 2
Europa Plus, Apologize, Timbaland and OneRepublic, за неделю, 1
Europa Plus, SOFI TUKKER feat NERVO The Knocks and Alisa Ueno - Best Friend, Alisa Ueno;NERVO;Sofi Tukker;The Knocks, за неделю, 1
Europa Plus, Catch, Kosheen, за неделю, 1
Europa Plus, Torn, Natalie Imbruglia, за неделю, 1
Europa Plus, Shes On My Mind, JP Cooper, за неделю, 2
Europa Plus, Work from Home ft Ty Dolla $ign, Fifth Harmony, за неделю, 1
Europa Plus, Ain’t Nobody (Loves Me Better), Felix Jaehn and Jasmine Thompson, за неделю, 1
Europa Plus, YOURE MINE (DJ ANTONIO and ASTERO REMIX), RAVING GEORGE, за неделю, 1
Europa Plus, PI_KATCHI, OFENBACH/NICK WATERHOUSE, за неделю, 2
Europa Plus, Livin In A World Without You, The Rasmus, за неделю, 1
Europa Plus, Rise Up, Thomas Jack and Jasmine Thompson, за неделю, 1
Europa Plus, I Never Felt So Right, Ben Delay, за неделю, 1
Europa Plus, A DIFFERENT WAY, DJ_SNAKE/LAUV, за неделю, 1
Europa Plus, Big City Life, Mattafix, за неделю, 1
Europa Plus, Stole The Show feat Parson James, Kygo, за неделю, 1
Europa Plus, Supreme, Robbie Williams, за неделю, 1
Europa Plus, Believer, Imagine Dragons, за неделю, 1
Europa Plus, IMPULSI, ELENA TEMNIKOVA, за неделю, 1
Europa Plus, The Power Of Goodbye, Madonna, за неделю, 1
Europa Plus, Ocean Drive (Michael Calfan Remix), Duke Dumont, за неделю, 1
Europa Plus, Attention, Charlie Puth, за неделю, 3
Europa Plus, Кружит, MONATIK, за неделю, 1
Europa Plus, Am I Wrong, Nico and Vinz, за неделю, 1
Europa Plus, All Four Walls ft Vaults, Gorgon City, за неделю, 1
Europa Plus, WAKE ME UP, AVICII, за неделю, 1
Europa Plus, Prayer In C, Lilly Wood and the Prick and Robin Schulz, за неделю, 1
Europa Plus, Endless Summer, Oceana, за неделю, 1
Europa Plus, I Dont Want to Miss, Aerosmith, за неделю, 1
Europa Plus, Stressed Out, Twenty One Pilots, за неделю, 2
Europa Plus, REALITY (CHRISTMAS MIX), LOST_FREQUENCIES, за неделю, 1
Europa Plus, Ghost Town, Adam Lambert, за неделю, 1
Europa Plus, Take Me To Church (remix), Hozier, за неделю, 1
Europa Plus, BLIND HEART, CAZZETTE/TERRI_B!, за неделю, 1
Europa Plus, Say It Right, Nelly Furtado, за неделю, 1
Europa Plus, SAD STORY+ID, MERK_and_KREMONT, за неделю, 1
Europa Plus, KING, YEARS_and_YEARS, за неделю, 1
Europa Plus, Small Talk, Fake Pictures and Tiger Park, за неделю, 1
Europa Plus, Freestyler, Bomfunk MCs, за неделю, 1
Europa Plus, TEDDY BEAR (ASTERO REMIX), KADEBOSTANY, за неделю, 1
Europa Plus, River Flows In You, Jasper Forks, за неделю, 1
Europa Plus, BOOM BOOM BOOM (GABRY PONTE REMIX), INDAQO, за неделю, 1
Europa Plus, Breathe, Seeb, за неделю, 1
Europa Plus, I HATE YOU I LOVE YOU, GNASH, за неделю, 1
Europa Plus, VERGE, OWL_CITY/ALOE BLACC, за неделю, 1
Europa Plus, Nana Song (ft Nina), Sherrie Sherrie and The Ware, за неделю, 4
Europa Plus, Let Go, Paul Van Dyk, за неделю, 1
Europa Plus, Hot Right Now, Dj Fresh and Rita Ora, за неделю, 1
Europa Plus, Freaky Like Me, Madcon, за неделю, 1
Europa Plus, Something Just Like This, The Chainsmokers and Coldplay, за неделю, 3
Europa Plus, Lonely Together ft Rita Ora (Alan Walker Remix), Avicii, за неделю, 2
Europa Plus, К черту любовь, Loboda, за неделю, 1
Europa Plus, ECHAME LA CULPA, LUIS FONSI/DEMI LOVATO, за неделю, 4
Europa Plus, Sad Story (Out Of Luck), Merk and Kremont, за неделю, 7
Europa Plus, THIS GIRL, KUNGS/COOKIN_ON_3_BURNES, за неделю, 1
Europa Plus, ARE YOU WITH ME (CHRISTMAS MIX), LOST_FREQUENCIES, за неделю, 1
Europa Plus, PI_TAKE ME TO INFINITY, CONSOUL_TRAININ, за неделю, 2
Europa Plus, THE ROAD (EFFECTIVE RADIO REMIX), FLYING_DECIBELS, за неделю, 4
Europa Plus, PI_OCEAN DRIVE, Duke Dumont, за неделю, 1
Europa Plus, MARIA MARIA, MARI FERRARI/MISS MARY, за неделю, 4
Europa Plus, Chandelier, Sia, за неделю, 1
Europa Plus, The Monster, Eminem and Rihanna, за неделю, 1
Europa Plus, Adventure Of A Lifetime, Coldplay, за неделю, 1
Europa Plus, Good Day, Yellow Claw and DJ Snake, за неделю, 1
Europa Plus, PI_MI GENTE, BALVIN and WILLY WLILLIAM, за неделю, 1
Europa Plus, Feel It Still, Portugal The Man, за неделю, 1
Europa Plus, PI_SUCKER FOR PAIN, LIL WAYNE IMAGINE DRAGONS, за неделю, 1
Europa Plus, Hymn For The Weekend, Coldplay, за неделю, 1
Europa Plus, Safe and Sound, Capital Cities, за неделю, 1
Europa Plus, WAY DOWN WE GO (REMIX), KALEO, за неделю, 1
Europa Plus, PI_THIS GIRL, Kungs, за неделю, 1
Europa Plus, LA LOUZE, SHANGUY, за неделю, 2
Europa Plus, Leap Of Faith, David Charvet, за неделю, 1
Europa Plus, Fairytale Gone Bad, Sunrise Avenue, за неделю, 1
Europa Plus, Sherrie Sherrie and The Ware feat Nina  - Nana Song, NINA;Sherrie Sherrie;The Ware, за неделю, 1
Europa Plus, Hurt, Christina Aguilera, за неделю, 1
Europa Plus, LUSH LIFE, Zara Larsson, за неделю, 1
Europa Plus, ALONE, Alan Walker, за неделю, 1
Europa Plus, PI_LORDLY, FEDER, за неделю, 1
