Europa Plus, La La La, Naughty Boy and Sam Smith, за неделю, 1
Europa Plus, Free Love, Depeche Mode, за неделю, 1
Europa Plus, IMPULSI+ID, ELENA TEMNIKOVA, за неделю, 2
Europa Plus, TEDDY BEAR (ASTERO REMIX), KADEBOSTANY, за неделю, 2
Europa Plus, PI_SUCKER FOR PAIN, LIL WAYNE IMAGINE DRAGONS, за неделю, 1
Europa Plus, Feel feat Sena Sener, Mahmut Orhan, за неделю, 1
Europa Plus, ECHAME LA CULPA, LUIS FONSI/DEMI LOVATO, за неделю, 3
Europa Plus, Feel It Still, Portugal The Man, за неделю, 1
Europa Plus, NEW RULES, Dua Lipa, за неделю, 5
Europa Plus, Rockafeller Skank, Fatboy Slim, за неделю, 1
Europa Plus, Kissing Strangers ft Nicki Minaj, DNCE, за неделю, 1
Europa Plus, Never Go Away, C-BooL, за неделю, 2
Europa Plus, Thrift Shop, Macklemore and Ryan Lewis, за неделю, 1
Europa Plus, Proper education, Eric Prydz, за неделю, 1
Europa Plus, Bonbon, Era Istrefi, за неделю, 2
Europa Plus, PI_BE MINE, OFENBACH, за неделю, 1
Europa Plus, PI_TUESDAY, BURAK YETER, за неделю, 1
Europa Plus, WAKE ME UP, AVICII, за неделю, 1
Europa Plus, Flashlight, Dj Fresh and Ellie Goulding, за неделю, 1
Europa Plus, DIRTY SEXY MONEY, DAVID GUETTA/AFROJACK/CHARLI_XCX, за неделю, 8
Europa Plus, Love Me Harder, Ariana Grande and The Weeknd, за неделю, 1
Europa Plus, THE OCEAN, MIKE PERRY, за неделю, 1
Europa Plus, Freaky Like Me, Madcon, за неделю, 1
Europa Plus, PI_TAKE ME TO INFINITY, CONSOUL_TRAININ, за неделю, 2
Europa Plus, The Monster, Eminem and Rihanna, за неделю, 1
Europa Plus, Wake Me Up, Avicii and Aloe Blacc, за неделю, 1
Europa Plus, Sweet Harmony, Sans Souci feat Pearl Andersson, за неделю, 1
Europa Plus, The Greatest, Sia feat Kendrick Lamar, за неделю, 2
Europa Plus, Something Just Like This, The Chainsmokers and Coldplay, за неделю, 1
Europa Plus, PI_STARBOY, Weeknd, за неделю, 1
Europa Plus, I Never Felt So Right, Ben Delay, за неделю, 1
Europa Plus, Bonbon, Era Istrefi, за неделю, 1
Europa Plus, Disco Tits, Tove Lo, за неделю, 2
Europa Plus, Song 2, Blur, за неделю, 1
Europa Plus, Sweet Harmony, Sans Souci feat Pearl Andersson, за неделю, 2
Europa Plus, I Know What You Want, Busta Rhymes and Mariah Carey, за неделю, 1
Europa Plus, Feel It Still, Portugal The Man, за неделю, 2
Europa Plus, LET ME LOVE YOU, DJ_SNAKE/JUSTIN BIEBER, за неделю, 2
Europa Plus, GET UGLY, JASON DERULO, за неделю, 1
Europa Plus, Rolling In The Deep, Adele, за неделю, 1
Europa Plus, Never Go Away, C-BooL, за неделю, 2
Europa Plus, Неделимы, Artik and Asti, за неделю, 1
Europa Plus, Dont Speak, No Doubt, за неделю, 1
Europa Plus, I HATE YOU I LOVE YOU, GNASH, за неделю, 1
Europa Plus, IN THE MORNING, JADED, за неделю, 5
Europa Plus, Easy Love, Sigala, за неделю, 1
Europa Plus, Till The End, Swanky Tunes and Going Deeper, за неделю, 1
Europa Plus, Case Depart, Team BS, за неделю, 1
Europa Plus, DIRTY SEXY MONEY, DAVID GUETTA/AFROJACK/CHARLI_XCX, за неделю, 8
Europa Plus, Euphoria, Loreen, за неделю, 1
Europa Plus, SLUCHAINAYA, LOBODA, за неделю, 1
Europa Plus, Single Lady, Dj Layla and Alissa, за неделю, 1
Europa Plus, To The Moon And Back, Savage Garden, за неделю, 1
Europa Plus, What  I’ve Done, Linkin Park, за неделю, 1
Europa Plus, Beggin, Madcon, за неделю, 1
Europa Plus, La Louze, SHANGUY, за неделю, 2
Europa Plus, WHATEVER IT TAKES, Imagine Dragons, за неделю, 8
Europa Plus, VERGE, OWL_CITY/ALOE BLACC, за неделю, 1
Europa Plus, Love The Way You Lie, Eminem and Rihanna, за неделю, 1
Europa Plus, Nana Song (ft Nina), Sherrie Sherrie and The Ware, за неделю, 5
Europa Plus, Hello, Adele, за неделю, 1
Europa Plus, PUMPED UP, Klingande, за неделю, 4
Europa Plus, BEST FRIEND, SOFI TUKKER/NERVO, за неделю, 6
Europa Plus, LONELY TOGETHER (ALAN WARKER REMIX), AVICII/RITA ORA, за неделю, 1
Europa Plus, Behind Blue Eyes, Limp Bizkit, за неделю, 1
Europa Plus, Written In The Stars, Tinie Tempah, за неделю, 1
Europa Plus, TU ES FOUTU, IN GRID, за неделю, 1
Europa Plus, Roulette, Katy Perry, за неделю, 3
Europa Plus, WONDERFUL LIFE, HURTS, за неделю, 1
Europa Plus, COOL GIRL, Tove Lo, за неделю, 1
Europa Plus, Till The End, Swanky Tunes and Going Deeper, за неделю, 1
Europa Plus, DONT STOP THE MUSIC, RIHANNA, за неделю, 1
Europa Plus, SOFI TUKKER feat NERVO The Knocks and Alisa Ueno - Best Friend, Alisa Ueno;NERVO;Sofi Tukker;The Knocks, за неделю, 2
Europa Plus, TELL ME WHO, VANOTEK/ENELI, за неделю, 1
Europa Plus, IMAGINATION, GORGON_CITY, за неделю, 1
Europa Plus, KATCHI, OFENBACH/NICK WATERHOUSE, за неделю, 7
Europa Plus, Gangstas Paradise, Coolio, за неделю, 1
Europa Plus, Numb, Jay-Z and Linkin Park, за неделю, 1
Europa Plus, Sweet Dreams, Eurythmics, за неделю, 1
Europa Plus, TAK KRASIVO (REMIX), SERGEY LAZAREV, за неделю, 6
Europa Plus, THE ROAD (EFFECTIVE RADIO REMIX), FLYING_DECIBELS, за неделю, 4
Europa Plus, NO ROOTS, ALICE MERTON, за неделю, 6
Europa Plus, Boom Boom Boom (Gabry Ponte Edit), Indaqo, за неделю, 1
Europa Plus, IMAGINATION, GORGON_CITY, за неделю, 1
Europa Plus, Whistle, Flo Rida, за неделю, 1
Europa Plus, How You Remind Me, Nickelback, за неделю, 1
Europa Plus, SHTRIKHI, BURITO, за неделю, 5
Europa Plus, TEDDY BEAR (ASTERO REMIX), KADEBOSTANY, за неделю, 1
Europa Plus, Lonely Together ft Rita Ora (Alan Walker Remix), Avicii, за неделю, 2
Europa Plus, Falling, Alesso, за неделю, 3
Europa Plus, PI_SHAPE OF YOU, Ed Sheeran, за неделю, 2
Europa Plus, TELL ME WHO, VANOTEK/ENELI, за неделю, 1
Europa Plus, REALITY (CHRISTMAS MIX), LOST_FREQUENCIES, за неделю, 1
Europa Plus, TIRED BONES, LBONE/LAENZ, за неделю, 5
Europa Plus, This Love, Maroon 5, за неделю, 1
Europa Plus, УВЛИУВТ, MONATIK, за неделю, 1
Europa Plus, Gangstas Paradise, Coolio, за неделю, 1
Europa Plus, LIGHT IT UP (REMIX), MAJOR_LAZER/FUSE_ODG, за неделю, 1
Europa Plus, Save Me, Morandi, за неделю, 1
Europa Plus, Endless Summer, Oceana, за неделю, 1
Europa Plus, Song 2, Blur, за неделю, 1
Europa Plus, Boom Boom Boom (Gabry Ponte Edit), Indaqo, за неделю, 2
Europa Plus, DONT LET ME DOWN, THE_CHAINSMOKERS, за неделю, 1
Europa Plus, Let Go, Paul Van Dyk, за неделю, 1
Europa Plus, Airplanes (feat Hayley Williams), BOB, за неделю, 1
Europa Plus, You Are The Only One, Сергей Лазарев, за неделю, 1
Europa Plus, SUSPICION (GOING DEEPER REMIX), LP, за неделю, 8
Europa Plus, PI_THUNDER, Imagine Dragons, за неделю, 1
Europa Plus, Кружит, MONATIK, за неделю, 1
Europa Plus, Dangerous, David Guetta feat Sam Martin, за неделю, 1
Europa Plus, Feel It Still, Portugal The Man, за неделю, 1
Europa Plus, I GOT LOVE, MIYAGI, за неделю, 1
Europa Plus, All The Right Moves, OneRepublic, за неделю, 1
Europa Plus, Case Depart, Team BS, за неделю, 1
Europa Plus, Thunder, Imagine Dragons, за неделю, 3
Europa Plus, Take Me To Church (remix), Hozier, за неделю, 1
Europa Plus, ROZOVOE VINO, ELDJAY/FEDUK, за неделю, 4
Europa Plus, Small Talk, Fake Pictures and Tiger Park, за неделю, 2
Europa Plus, Waiting For The Summer, Deepend ft Graham Candy, за неделю, 5
Europa Plus, Cake By The Ocean, DNCE, за неделю, 2
Europa Plus, Улети, T-Fest, за неделю, 5
Europa Plus, Lead The Way, TON!C Feat Erick Gold, за неделю, 1
Europa Plus, DONT STOP THE MUSIC, RIHANNA, за неделю, 1
Europa Plus, ECHAME LA CULPA, LUIS FONSI/DEMI LOVATO, за неделю, 3
Europa Plus, PI_BONBON, ERA ISTREFI, за неделю, 1
Europa Plus, You Spin Me Round, Danzel, за неделю, 1
Europa Plus, What Goes Around…Comes Around, Justin Timberlake, за неделю, 1
Europa Plus, I GOT LOVE, MIYAGI, за неделю, 1
Europa Plus, IN THE MORNING, JADED, за неделю, 3
Europa Plus, Sweet Harmony, Sans Souci feat Pearl Andersson, за неделю, 1
Europa Plus, SAD STORY+ID, MERK_and_KREMONT, за неделю, 1
Europa Plus, Stereo Hearts, Gym Class Heroes feat Adam Levine, за неделю, 1
Europa Plus, SHTRIKHI, BURITO, за неделю, 6
Europa Plus, FEEL YOU, NABBOO/MISHA MUILLER, за неделю, 2
Europa Plus, Dusk Till Dawn ft Sia, ZAYN, за неделю, 6
Europa Plus, READY TO GO, HURTS, за неделю, 1
Europa Plus, SWISH SWISH, KATY PERRY/NICKI MINAJ, за неделю, 2
Europa Plus, DONT LET ME DOWN, THE_CHAINSMOKERS, за неделю, 1
Europa Plus, ECHAME LA CULPA, LUIS FONSI/DEMI LOVATO, за неделю, 3
Europa Plus, PI_THIS GIRL, Kungs, за неделю, 1
Europa Plus, Just Like Fire, Pink, за неделю, 1
Europa Plus, Sing For The Moment, Eminem, за неделю, 1
Europa Plus, Blurred Lines, Robin Thicke and TI & Pharrell, за неделю, 1
Europa Plus, My Immortal, Evanescence, за неделю, 1
Europa Plus, SUGAR, ROBIN SCHULZ/FRANCESCO YATES, за неделю, 2
Europa Plus, MORE THAN YOU KNOW, AXWELL_and_INGROSOO, за неделю, 3
Europa Plus, I Never Felt So Right, Ben Delay, за неделю, 1
Europa Plus, Adventure Of A Lifetime, Coldplay, за неделю, 1
Europa Plus, Paso, Sak Noel, за неделю, 1
Europa Plus, TAK KRASIVO (REMIX), SERGEY LAZAREV, за неделю, 4
Europa Plus, WALKING ON AIR, ANISE_K/SNOOP DOGG, за неделю, 1
Europa Plus, NEW RULES, Dua Lipa, за неделю, 5
Europa Plus, I Never Felt So Right, Ben Delay, за неделю, 1
Europa Plus, Fight Back With Love Tonight, Kush Kush, за неделю, 1
Europa Plus, Verge ft Aloe Blacc, Owl City, за неделю, 1
Europa Plus, Work from Home ft Ty Dolla $ign, Fifth Harmony, за неделю, 2
Europa Plus, Ocean Drive (Michael Calfan Remix), Duke Dumont, за неделю, 2
Europa Plus, YA OBESHAYU, NASTYA KUDRI/ALEXEY VOROBYEV, за неделю, 2
Europa Plus, Fairytale Gone Bad, Sunrise Avenue, за неделю, 1
Europa Plus, Thunder, Imagine Dragons, за неделю, 1
Europa Plus, Dont Phunk With My Heart, Black Eyed Peas, за неделю, 1
Europa Plus, Sous Loeil De Lange, K-Maro, за неделю, 1
Europa Plus, Roulette, Katy Perry, за неделю, 3
Europa Plus, Улети, T-Fest, за неделю, 5
Europa Plus, SLUCHAINAYA, LOBODA, за неделю, 1
Europa Plus, SMALL TALK, FAKE_PICTURES, за неделю, 1
Europa Plus, Teach Me, Bakermat, за неделю, 1
Europa Plus, BREATHE, Jax Jones, за неделю, 1
Europa Plus, Sad Story (Out Of Luck), Merk and Kremont, за неделю, 7
Europa Plus, DISCO TITS, Tove Lo, за неделю, 1
Europa Plus, Touch You Right Now, Basic Element, за неделю, 1
Europa Plus, If I Lose Myself (Remix), Alesso Vs OneRepublic, за неделю, 1
Europa Plus, Reality, Lost Frequencies feat Janieck Devy, за неделю, 1
Europa Plus, I HATE YOU I LOVE YOU, GNASH, за неделю, 1
Europa Plus, Paparazzi, Lady Gaga, за неделю, 1
Europa Plus, PI_HUMAN, RAGNBONE_MAN, за неделю, 1
Europa Plus, Love Me Again, John Newman, за неделю, 1
Europa Plus, ALONE, Alan Walker, за неделю, 1
Europa Plus, Adventure Of A Lifetime, Coldplay, за неделю, 1
Europa Plus, SHTRIKHI, BURITO, за неделю, 2
Europa Plus, JAI CHERCHE, AMIR, за неделю, 1
Europa Plus, LIGHT IT UP (REMIX), MAJOR_LAZER/FUSE_ODG, за неделю, 2
Europa Plus, Breathe (ft Ina Wroldsen), Jax Jones, за неделю, 2
Europa Plus, Airplanes, BoB and Hayley Williams, за неделю, 1
Europa Plus, SUSPICION (GOING DEEPER REMIX), LP, за неделю, 8
Europa Plus, Tuesday ft Danelle Sandoval, Burak Yeter, за неделю, 2
Europa Plus, Nana Song (ft Nina), Sherrie Sherrie and The Ware, за неделю, 5
Europa Plus, BREATHE, Jax Jones, за неделю, 1
Europa Plus, You Are The Only One, Сергей Лазарев, за неделю, 1
Europa Plus, Take Me To Infinity, Consoul Trainin, за неделю, 1
Europa Plus, Lonely Together ft Rita Ora (Alan Walker Remix), Avicii, за неделю, 1
Europa Plus, Red Lights, Tiesto, за неделю, 1
Europa Plus, TIRED BONES, LBONE/LAENZ, за неделю, 6
Europa Plus, ALONE, Alan Walker, за неделю, 1
Europa Plus, WALKING ON AIR, ANISE_K/SNOOP DOGG, за неделю, 1
Europa Plus, WHATEVER IT TAKES, Imagine Dragons, за неделю, 8
Europa Plus, LUSH LIFE, Zara Larsson, за неделю, 1
Europa Plus, All The Right Moves, OneRepublic, за неделю, 1
Europa Plus, READY TO GO, HURTS, за неделю, 1
Europa Plus, Small Talk, Fake Pictures and Tiger Park, за неделю, 1
Europa Plus, NO ROOTS, ALICE MERTON, за неделю, 6
Europa Plus, Туманы, Макс Барских, за неделю, 1
Europa Plus, Desert Rose, Sting, за неделю, 1
Europa Plus, Blame, Calvin Harris and John Newman, за неделю, 1
Europa Plus, ARE YOU WITH ME, LOST_FREQUENCIES, за неделю, 1
Europa Plus, Starboy ft Daft Punk, The Weeknd, за неделю, 1
Europa Plus, Never Be the Same Again, Melanie C / Lisa Left Eye Lopez, за неделю, 1
Europa Plus, Changes, Faul and Wad Ad vs Pnau, за неделю, 1
Europa Plus, PUMPED UP, Klingande, за неделю, 6
Europa Plus, Hear Me Now, Alok Bruno Martini feat Zeeba, за неделю, 1
Europa Plus, SUSPICION (GOING DEEPER REMIX), LP, за неделю, 8
Europa Plus, SLUCHAINAYA, LOBODA, за неделю, 1
Europa Plus, ROZOVOE VINO, ELDJAY/FEDUK, за неделю, 4
Europa Plus, IMAGINATION, GORGON_CITY, за неделю, 1
Europa Plus, Fight Back With Love Tonight, Kush Kush, за неделю, 3
Europa Plus, KATCHI, OFENBACH/NICK WATERHOUSE, за неделю, 5
Europa Plus, Attention, Charlie Puth, за неделю, 3
Europa Plus, PI_HYMN FOR WEEKEND, Coldplay, за неделю, 2
Europa Plus, Неделимы, Artik and Asti, за неделю, 1
Europa Plus, In The Morning, Jaded, за неделю, 1
Europa Plus, Freestyler, Bomfunk MCs, за неделю, 1
Europa Plus, LET’S GO, K-Maro, за неделю, 1
Europa Plus, MIND IF I STAY (ASTERO REMIX), KADEBOSTANY, за неделю, 2
Europa Plus, Sweet Dreams, Eurythmics, за неделю, 1
Europa Plus, DONT LET ME GO (REMIX), KANITA, за неделю, 2
Europa Plus, Оружие, Пицца, за неделю, 1
Europa Plus, К черту любовь, Loboda, за неделю, 1
Europa Plus, Beautiful Liar, BEYONCE and SHAKIRA, за неделю, 1
Europa Plus, Falling, Alesso, за неделю, 2
Europa Plus, PI_SOMETHING JUST LIKE THIS, THE CHAINSMOKERS COLDPLAY, за неделю, 1
Europa Plus, Higher Place, Dimitri Vegas and Like Mike & Ne-Yo, за неделю, 1
Europa Plus, WICKED GAMES, PARRA_FOR_CUVA/ANNA NAKLAB, за неделю, 1
Europa Plus, Ocean Drive (Michael Calfan Remix), Duke Dumont, за неделю, 2
Europa Plus, Small Talk, Fake Pictures and Tiger Park, за неделю, 1
Europa Plus, BOOK OF LOVE, FELIX JAEHN/POLINA, за неделю, 1
Europa Plus, You Are The Only One, Сергей Лазарев, за неделю, 2
Europa Plus, WAY DOWN WE GO (REMIX), KALEO, за неделю, 1
Europa Plus, PI_ROULETTE, KATY PERRY, за неделю, 1
Europa Plus, Wide Awake, Eric Saade feat Gustav Noren Filatov and Karas, за неделю, 1
Europa Plus, FEEL YOU, NABBOO/MISHA MILLER, за неделю, 1
Europa Plus, IN THE MORNING, JADED, за неделю, 4
Europa Plus, Breathe (ft Ina Wroldsen), Jax Jones, за неделю, 2
Europa Plus, Dusk Till Dawn ft Sia, ZAYN, за неделю, 6
Europa Plus, Hello, Adele, за неделю, 1
Europa Plus, Come Along, Titiyo, за неделю, 1
Europa Plus, La Cancion, Tim3bomb, за неделю, 2
Europa Plus, Океанами Стали, Alekseev, за неделю, 1
Europa Plus, Umbrella, Rihanna, за неделю, 1
Europa Plus, rockstar, Post Malone feat 21 Savage, за неделю, 8
Europa Plus, PI_DUSK TILL DAWN, ZAYN/SIA, за неделю, 2
Europa Plus, Shes On My Mind, JP Cooper, за неделю, 4
Europa Plus, Way Down We Go, Kaleo, за неделю, 3
Europa Plus, Pop Corn, Boostee, за неделю, 1
Europa Plus, PI_JUST LIKE FIRE, PINK, за неделю, 1
Europa Plus, Stressed Out, Twenty One Pilots, за неделю, 2
Europa Plus, Boom Boom Boom (Gabry Ponte Edit), Indaqo, за неделю, 2
Europa Plus, Touch You Right Now, Basic Element, за неделю, 1
Europa Plus, DISCO TITS, Tove Lo, за неделю, 1
Europa Plus, Heathens, Twenty One Pilots, за неделю, 2
Europa Plus, Every Single Day, BENASSI BROS/DHANY, за неделю, 1
Europa Plus, Blow Your Mind (Mwah), Dua Lipa, за неделю, 1
Europa Plus, WALK, KWABS, за неделю, 1
Europa Plus, MI GENTE, J_BALVIN/WILLY WILLIAM, за неделю, 1
Europa Plus, Unstoppable, Sia, за неделю, 1
Europa Plus, Airplanes, BoB and Hayley Williams, за неделю, 1
Europa Plus, Under, Alex Hepburn, за неделю, 1
Europa Plus, We Own It, 2 Chainz and Wiz Khalifa, за неделю, 1
Europa Plus, LOST ON YOU (SWANKY TUNES and GOING DEEPER REMIX), LP, за неделю, 1
Europa Plus, Lordly, Feder feat Alex Aiono, за неделю, 1
Europa Plus, What Goes Around…Comes Around, Justin Timberlake, за неделю, 1
Europa Plus, PAPAOUTAI, STROMAE, за неделю, 1
Europa Plus, SWISH SWISH, KATY PERRY/NICKI MINAJ, за неделю, 1
Europa Plus, Boom Boom Boom (Gabry Ponte Edit), Indaqo, за неделю, 2
Europa Plus, Single Lady, Dj Layla and Alissa, за неделю, 1
Europa Plus, HEROES, Alesso, за неделю, 2
Europa Plus, CLINT EASTWOOD, GORILLAZ (mix), за неделю, 1
Europa Plus, Rather Be, Clean Bandit, за неделю, 1
Europa Plus, I GOT LOVE, MIYAGI, за неделю, 2
Europa Plus, WE DONT TALK ANYMORE, CHARLIE PUTH/SELENA GOMES, за неделю, 1
Europa Plus, Never Go Away, C-BooL, за неделю, 1
Europa Plus, WHY DOES MY HEART FEEL SO BAD, MOBY, за неделю, 1
Europa Plus, BEST FRIEND, SOFI TUKKER/NERVO, за неделю, 7
Europa Plus, Human, RagnBone Man, за неделю, 2
Europa Plus, What Goes Around…Comes Around, Justin Timberlake, за неделю, 1
Europa Plus, rockstar, Post Malone feat 21 Savage, за неделю, 8
Europa Plus, How Deep Is Your Love, Calvin Harris and Disciples, за неделю, 1
Europa Plus, SUSPICION (GOING DEEPER REMIX), LP, за неделю, 8
Europa Plus, PI_JUST LIKE FIRE, PINK, за неделю, 1
Europa Plus, PI_DONT LET ME DOWN, The Chainsmokers, за неделю, 2
Europa Plus, NEW RULES, Dua Lipa, за неделю, 5
Europa Plus, Butterfly, Crazy Town, за неделю, 1
Europa Plus, The Greatest, Sia feat Kendrick Lamar, за неделю, 1
Europa Plus, Tuesday ft Danelle Sandoval, Burak Yeter, за неделю, 1
Europa Plus, Heathens, Twenty One Pilots, за неделю, 2
Europa Plus, SHTRIKHI+ID, BURITO, за неделю, 2
Europa Plus, Hear Me Now, Alok Bruno Martini feat Zeeba, за неделю, 1
Europa Plus, MI GENTE, J_BALVIN/WILLY WILLIAM, за неделю, 3
Europa Plus, Туманы, Макс Барских, за неделю, 1
Europa Plus, FUCK THEM ALL, MYLENE FARMER, за неделю, 1
Europa Plus, Bonbon, Era Istrefi, за неделю, 1
Europa Plus, La Louze, SHANGUY, за неделю, 1
Europa Plus, Cake By The Ocean, DNCE, за неделю, 1
Europa Plus, Angels, Morandi, за неделю, 1
Europa Plus, DISCO TITS, Tove Lo, за неделю, 1
Europa Plus, Sweet Harmony, Sans Souci feat Pearl Andersson, за неделю, 1
Europa Plus, УВЛИУВТ, MONATIK, за неделю, 1
Europa Plus, PI_TUESDAY, BURAK YETER, за неделю, 1
Europa Plus, BEST FRIEND, SOFI TUKKER/NERVO, за неделю, 3
Europa Plus, IMAGINATION, GORGON_CITY, за неделю, 1
Europa Plus, Diamonds, Rihanna, за неделю, 1
Europa Plus, I Remember The Time, Nana, за неделю, 1
Europa Plus, You Dont Know Me ft RAYE, Jax Jones, за неделю, 1
Europa Plus, KNOW MY LOVE +ID, MATT NASH, за неделю, 1
Europa Plus, UPTOWN FUNK, MARC RONSON/BRUNO MARS, за неделю, 1
Europa Plus, Radioactive, Imagine Dragons, за неделю, 1
Europa Plus, PI_WAY DOWN WE GO, KALEO, за неделю, 4
Europa Plus, NEVER LET YOU GO, MOSIMANN/JOE CLEERE, за неделю, 8
Europa Plus, MARIA MARIA, MARI FERRARI/MISS MARY, за неделю, 4
Europa Plus, Rich Boy, Galantis, за неделю, 2
Europa Plus, Nana Song (ft Nina), Sherrie Sherrie and The Ware, за неделю, 5
Europa Plus, edit_RIVER FLOWS IN YOU, JASPER FORKS, за неделю, 1
Europa Plus, CALIFORNIA DREAMIN, ROYAL_GIGOLOS, за неделю, 1
Europa Plus, SOFI TUKKER feat NERVO The Knocks and Alisa Ueno - Best Friend, Alisa Ueno;NERVO;Sofi Tukker;The Knocks, за неделю, 5
Europa Plus, Lady (Hear Me Tonight), Modjo, за неделю, 1
Europa Plus, Feel, Robbie Williams, за неделю, 1
Europa Plus, If Theres Any Justice, Lemar, за неделю, 1
Europa Plus, YOU KNOW YOU LIKE IT, ALUNAGEORGE/DJ_SNAKE, за неделю, 1
Europa Plus, Cupids Chokeholold, Gym Class Heroes, за неделю, 1
Europa Plus, PI_MI GENTE, BALVIN and WILLY WLILLIAM, за неделю, 1
Europa Plus, Be Mine, Ofenbach, за неделю, 1
Europa Plus, Stole The Show feat Parson James, Kygo, за неделю, 1
Europa Plus, Say It Right, Nelly Furtado, за неделю, 1
Europa Plus, BREATHE, Jax Jones, за неделю, 1
Europa Plus, PI_DONT LET ME DOWN, The Chainsmokers, за неделю, 1
Europa Plus, FEMME LIKE U, K-MARO, за неделю, 1
Europa Plus, COOL GIRL, Tove Lo, за неделю, 1
Europa Plus, UPTOWN FUNK, MARC RONSON/BRUNO MARS, за неделю, 1
Europa Plus, If Today Was Your Last Day, Nickelback, за неделю, 1
Europa Plus, Toxic, Britney Spears, за неделю, 1
Europa Plus, Primadonna, Marina And The Diamonds, за неделю, 1
Europa Plus, U + Ur Hand, Pink, за неделю, 1
Europa Plus, If Everyone Cared, Nickelback, за неделю, 1
Europa Plus, Dangerous, David Guetta feat Sam Martin, за неделю, 1
Europa Plus, FEEL YOU, NABBOO/MISHA MILLER, за неделю, 1
Europa Plus, Cheap Thrills (feat Sean Paul), Sia, за неделю, 1
Europa Plus, LIGHT IT UP (REMIX), MAJOR_LAZER/FUSE_ODG, за неделю, 1
Europa Plus, GET LUCKY, DAFT_PUNK, за неделю, 1
Europa Plus, La Louze, SHANGUY, за неделю, 1
Europa Plus, Rolling In The Deep, Adele, за неделю, 1
Europa Plus, NEVER LET YOU GO, MOSIMANN/JOE CLEERE, за неделю, 9
Europa Plus, PUMPED UP, Klingande, за неделю, 5
Europa Plus, PI_ROULETTE, KATY PERRY, за неделю, 3
Europa Plus, Blow Your Mind (Mwah), Dua Lipa, за неделю, 2
Europa Plus, Way Down We Go, Kaleo, за неделю, 3
Europa Plus, Lordly, Feder feat Alex Aiono, за неделю, 1
Europa Plus, TIRED BONES, LBONE/LAENZ, за неделю, 6
Europa Plus, MIND IF I STAY (ASTERO REMIX), KADEBOSTANY, за неделю, 3
Europa Plus, Rockstar, POST_MALONE/21_SAVAGE, за неделю, 1
Europa Plus, PI_STARBOY, Weeknd, за неделю, 1
Europa Plus, TELL ME WHO, VANOTEK/ENELI, за неделю, 3
Europa Plus, Breathe (ft Ina Wroldsen), Jax Jones, за неделю, 1
Europa Plus, Castle Walls, TI feat Christina Aguilera, за неделю, 1
Europa Plus, IN THE SHADOWS, RASMUS, за неделю, 1
Europa Plus, THE OCEAN, MIKE PERRY, за неделю, 2
Europa Plus, PI_SHAPE OF YOU, Ed Sheeran, за неделю, 1
Europa Plus, PI_I NEVER FELT SO RIGHT, BEN DELAY, за неделю, 1
Europa Plus, COOL GIRL, Tove Lo, за неделю, 1
Europa Plus, Waves, Mr Probz, за неделю, 1
Europa Plus, Roulette, Katy Perry, за неделю, 4
Europa Plus, PI_HUMAN, RAGNBONE_MAN, за неделю, 1
Europa Plus, YA OBESHAYU, NASTYA KUDRI/ALEXEY VOROBYEV, за неделю, 1
Europa Plus, Got U (Ready Or Not), Kokab, за неделю, 1
Europa Plus, Thrift Shop, Macklemore and Ryan Lewis, за неделю, 1
Europa Plus, WALKING ON AIR, ANISE_K/SNOOP DOGG, за неделю, 1
Europa Plus, SUGAR, ROBIN SCHULZ/FRANCESCO YATES, за неделю, 1
Europa Plus, WE DONT TALK ANYMORE, CHARLIE PUTH/SELENA GOMES, за неделю, 1
Europa Plus, CALIFORNICATION, RED_HOT_CHILI_PEPPERS, за неделю, 1
Europa Plus, Under, Alex Hepburn, за неделю, 1
Europa Plus, L’Amour N’est Rien, Mylene Farmer, за неделю, 1
Europa Plus, BLAME, MATVEY EMERSON/ASTERO, за неделю, 1
Europa Plus, Kiss, Serebro, за неделю, 1
Europa Plus, FIVE MORE HOURS, DEORRO, за неделю, 1
Europa Plus, DIRTY SEXY MONEY, DAVID GUETTA/AFROJACK/CHARLI_XCX, за неделю, 9
Europa Plus, You Dont Know Me ft RAYE, Jax Jones, за неделю, 1
Europa Plus, SandM, Rihanna, за неделю, 1
Europa Plus, SCARED TO BE LONELY, MARTIN GARRIX/DUA LIPA, за неделю, 1
Europa Plus, PI_KATCHI, OFENBACH/NICK WATERHOUSE, за неделю, 3
Europa Plus, SCARED TO BE LONELY, MARTIN GARRIX/DUA LIPA, за неделю, 1
Europa Plus, CLOSER (REMIX), NE-YO, за неделю, 1
Europa Plus, Waiting For The Summer, Deepend ft Graham Candy, за неделю, 4
Europa Plus, LUSH LIFE, Zara Larsson, за неделю, 1
Europa Plus, TAK KRASIVO (REMIX), SERGEY LAZAREV, за неделю, 5
