Europa Plus, I Like It, Narcotic Thrust, за неделю, 1
Europa Plus, OHLALA, MRDA-NOS, за неделю, 3
Europa Plus, WAKE ME UP, AVICII, за неделю, 1
Europa Plus, GET LUCKY, DAFT_PUNK, за неделю, 1
Europa Plus, TEDDY BEAR (ASTERO REMIX), KADEBOSTANY, за неделю, 2
Europa Plus, PI_DUSK TILL DAWN, ZAYN/SIA, за неделю, 5
Europa Plus, SUNSHINE, CAT_DEALERS, за неделю, 3
Europa Plus, We Own It, 2 Chainz and Wiz Khalifa, за неделю, 1
Europa Plus, Unstoppable, Sia, за неделю, 1
Europa Plus, NO ROOTS, ALICE MERTON, за неделю, 10
Europa Plus, PI_ROULETTE, KATY PERRY, за неделю, 5
Europa Plus, U + Ur Hand, Pink, за неделю, 1
Europa Plus, Little Mix - Is Your Love Enough, Little Mix, за неделю, 7
Europa Plus, PI_BONBON, ERA ISTREFI, за неделю, 2
Europa Plus, SAD STORY+ID, MERK_and_KREMONT, за неделю, 3
Europa Plus, WALK, KWABS, за неделю, 1
Europa Plus, Attention, Charlie Puth, за неделю, 2
Europa Plus, You Dont Know Me ft RAYE, Jax Jones, за неделю, 1
Europa Plus, Heaven, Timofey Bartosz Brenes and Terri B!, за неделю, 1
Europa Plus, COLA (ROBIN SCHULZ REMIX), CAMELPHAT_and_ELDERBROOK, за неделю, 2
Europa Plus, You Spin Me Round, Danzel, за неделю, 1
Europa Plus, Dangerous, David Guetta feat Sam Martin, за неделю, 1
Europa Plus, DONT LET ME GO (REMIX), KANITA, за неделю, 2
Europa Plus, BEST FRIEND, SOFI TUKKER/NERVO, за неделю, 6
Europa Plus, Airplanes, BoB and Hayley Williams, за неделю, 2
Europa Plus, Fight Back With Love Tonight, Kush Kush, за неделю, 5
Europa Plus, Sad Story (Out Of Luck), Merk and Kremont, за неделю, 2
Europa Plus, I Follow Rivers, Lykke Li, за неделю, 1
Europa Plus, If Today Was Your Last Day, Nickelback, за неделю, 2
Europa Plus, rockstar, Post Malone feat 21 Savage, за неделю, 4
Europa Plus, Dusk Till Dawn ft Sia, ZAYN, за неделю, 4
Europa Plus, PI_WAY DOWN WE GO, KALEO, за неделю, 3
Europa Plus, Written In The Stars, Tinie Tempah, за неделю, 1
Europa Plus, Sofi Tukker - Best Friend_ID, , за неделю, 1
Europa Plus, Take Me To Infinity, Consoul Trainin, за неделю, 1
Europa Plus, DEMONS, Imagine Dragons, за неделю, 1
Europa Plus, ANYWHERE, Rita Ora, за неделю, 3
Europa Plus, KING, YEARS_and_YEARS, за неделю, 1
Europa Plus, Way Down We Go, Kaleo, за неделю, 3
Europa Plus, GET UGLY, JASON DERULO, за неделю, 1
Europa Plus, IMPULSI+ID, ELENA TEMNIKOVA, за неделю, 1
Europa Plus, ROZOVOE VINO, ELDJAY/FEDUK, за неделю, 3
Europa Plus, Again and Again, Basto, за неделю, 1
Europa Plus, PI_SHAPE OF YOU, Ed Sheeran, за неделю, 1
Europa Plus, TELL ME WHO, VANOTEK/ENELI, за неделю, 2
Europa Plus, NEW RULES, Dua Lipa, за неделю, 2
Europa Plus, HERE WITHOUT YOU, 3_DOORS_DOWN, за неделю, 1
Europa Plus, You Are The Only One, Сергей Лазарев, за неделю, 2
Europa Plus, Hear Me Now, Alok Bruno Martini feat Zeeba, за неделю, 2
Europa Plus, I KISSED A GIRL, KATY PERRY, за неделю, 1
Europa Plus, Улети, T-Fest, за неделю, 4
Europa Plus, COOL GIRL, Tove Lo, за неделю, 1
Europa Plus, BLIND HEART, CAZZETTE/TERRI_B!, за неделю, 2
Europa Plus, NEVER LET YOU GO, MOSIMANN/JOE CLEERE, за неделю, 7
Europa Plus, Rise And Fall, Craig David / Sting, за неделю, 1
Europa Plus, Frozen, Madonna, за неделю, 1
Europa Plus, Let Go, Paul Van Dyk, за неделю, 1
Europa Plus, FIVE MORE HOURS, DEORRO, за неделю, 1
Europa Plus, BREATHE, Jax Jones, за неделю, 1
Europa Plus, Touch You Right Now, Basic Element, за неделю, 2
Europa Plus, La Louze, SHANGUY, за неделю, 1
Europa Plus, The Hills, The Weeknd, за неделю, 1
Europa Plus, Stressed Out, Twenty One Pilots, за неделю, 1
Europa Plus, Just Like Fire, Pink, за неделю, 2
Europa Plus, Blame, Calvin Harris and John Newman, за неделю, 1
Europa Plus, PI_STARBOY, Weeknd, за неделю, 1
Europa Plus, DIRTY SEXY MONEY, DAVID GUETTA/AFROJACK/CHARLI_XCX, за неделю, 8
Europa Plus, К черту любовь, Loboda, за неделю, 1
Europa Plus, Thunder, Imagine Dragons, за неделю, 2
Europa Plus, YA OBESHAYU, NASTYA KUDRI/ALEXEY VOROBYEV, за неделю, 1
Europa Plus, Kisses Back, Matthew Koma, за неделю, 1
Europa Plus, Addicted, Serge Devant and Hadley, за неделю, 1
Europa Plus, SWISH SWISH, KATY PERRY/NICKI MINAJ, за неделю, 1
Europa Plus, Till The End, Swanky Tunes and Going Deeper, за неделю, 1
Europa Plus, UPTOWN FUNK, MARC RONSON/BRUNO MARS, за неделю, 1
Europa Plus, Endless Summer, Oceana, за неделю, 1
Europa Plus, Young and Beautiful (Kevin Blanc remix), Lana Del Rey, за неделю, 1
Europa Plus, Something Just Like This, The Chainsmokers and Coldplay, за неделю, 1
Europa Plus, rockstar, Post Malone feat 21 Savage, за неделю, 8
Europa Plus, Safe and Sound, Capital Cities, за неделю, 1
Europa Plus, Shes On My Mind, JP Cooper, за неделю, 2
Europa Plus, On My Way ft Bright Sparks, Tiesto, за неделю, 1
Europa Plus, SCARED TO BE LONELY, MARTIN GARRIX/DUA LIPA, за неделю, 1
Europa Plus, MAMBO ITALIANO, SHAFT, за неделю, 1
Europa Plus, MI GENTE, J_BALVIN/WILLY WILLIAM, за неделю, 1
Europa Plus, TIRED BONES, LBONE/LAENZ, за неделю, 6
Europa Plus, Ocean Drive (Michael Calfan Remix), Duke Dumont, за неделю, 1
Europa Plus, BEST FRIEND, SOFI TUKKER/NERVO, за неделю, 5
Europa Plus, LOVEDRUNK, SOPHIE FRANCIS, за неделю, 3
Europa Plus, TAK KRASIVO (REMIX), SERGEY LAZAREV, за неделю, 6
Europa Plus, Rolling In The Deep, Adele, за неделю, 1
Europa Plus, DONT LET ME DOWN, THE_CHAINSMOKERS, за неделю, 1
Europa Plus, Scream and Shout, William and Britney Spears, за неделю, 1
Europa Plus, NEW RULES, Dua Lipa, за неделю, 5
Europa Plus, MARIA MARIA, MARI FERRARI/MISS MARY, за неделю, 3
Europa Plus, BRING ME TO LIFE, EVANESCENCE, за неделю, 1
Europa Plus, TIRED BONES, LBONE, за неделю, 7
Europa Plus, Im Not The Only One, Sam Smith, за неделю, 1
Europa Plus, Black Black Heart, David Usher, за неделю, 1
Europa Plus, MIND IF I STAY (ASTERO REMIX), KADEBOSTANY, за неделю, 2
Europa Plus, On My Way ft Bright Sparks, Tiesto, за неделю, 2
Europa Plus, Get Lost, Paul Damixie, за неделю, 1
Europa Plus, KATCHI, OFENBACH/NICK WATERHOUSE, за неделю, 2
Europa Plus, I Don’t Wanna Live Forever (Fifty Shades Darker), ZAYN and Taylor Swift, за неделю, 1
Europa Plus, LA LOUZE, SHANGUY, за неделю, 3
Europa Plus, IMPULSI, ELENA TEMNIKOVA, за неделю, 1
Europa Plus, WHATEVER IT TAKES, Imagine Dragons, за неделю, 8
Europa Plus, Вдох, Елена Темникова, за неделю, 1
Europa Plus, PI_BONBON, ERA ISTREFI, за неделю, 1
Europa Plus, THE OCEAN, MIKE PERRY, за неделю, 1
Europa Plus, PI_OCEAN DRIVE, Duke Dumont, за неделю, 1
Europa Plus, TAK KRASIVO (REMIX), SERGEY LAZAREV, за неделю, 3
Europa Plus, SAD STORY+ID, MERK_and_KREMONT, за неделю, 1
Europa Plus, BOOM BOOM BOOM (GABRY PONTE REMIX), INDAQO, за неделю, 1
Europa Plus, Face ALa Mer, Calogero / Passi, за неделю, 1
Europa Plus, IMAGINATION, GORGON_CITY, за неделю, 1
Europa Plus, WHAT DO YOU MEAN, Justin Bieber, за неделю, 1
Europa Plus, SandM, Rihanna, за неделю, 1
Europa Plus, Attention, Charlie Puth, за неделю, 2
Europa Plus, PI_DUSK TILL DAWN, ZAYN/SIA, за неделю, 1
Europa Plus, Shape Of You, Ed Sheeran, за неделю, 1
Europa Plus, The Greatest, Sia feat Kendrick Lamar, за неделю, 1
Europa Plus, WAY DOWN WE GO (REMIX), KALEO, за неделю, 1
Europa Plus, When We Stand Together, Nickelback, за неделю, 1
Europa Plus, Too Close, Alex Clare, за неделю, 1
Europa Plus, PI_JUST LIKE FIRE, PINK, за неделю, 1
Europa Plus, DONT LET ME DOWN, THE_CHAINSMOKERS, за неделю, 1
Europa Plus, Waves, Mr Probz, за неделю, 1
Europa Plus, Feel It Still, Portugal The Man, за неделю, 2
Europa Plus, Work from Home ft Ty Dolla $ign, Fifth Harmony, за неделю, 2
Europa Plus, ITS RAINING MEN, GERI HALLIWELL, за неделю, 1
Europa Plus, Dont Stop The Music, Rihanna, за неделю, 1
Europa Plus, Whistle, Flo Rida, за неделю, 1
Europa Plus, IN THE MORNING, JADED, за неделю, 5
Europa Plus, WALK, KWABS, за неделю, 1
Europa Plus, PI_MI GENTE, BALVIN and WILLY WLILLIAM, за неделю, 1
Europa Plus, SHTRIKHI, BURITO, за неделю, 2
Europa Plus, YA OBESHAYU, NASTYA KUDRI/ALEXEY VOROBYEV, за неделю, 2
Europa Plus, Stan, Eminem Feat Dido, за неделю, 1
Europa Plus, Small Talk, Fake Pictures and Tiger Park, за неделю, 1
Europa Plus, LUSH LIFE, Zara Larsson, за неделю, 2
Europa Plus, Shanguy - La Louze, SHANGUY, за неделю, 5
Europa Plus, PI_I NEVER FELT SO RIGHT, BEN DELAY, за неделю, 1
Europa Plus, Way Down We Go, Kaleo, за неделю, 6
Europa Plus, REALITY (CHRISTMAS MIX), LOST_FREQUENCIES, за неделю, 1
Europa Plus, Rise Up, Thomas Jack and Jasmine Thompson, за неделю, 2
Europa Plus, WHATEVER IT TAKES, Imagine Dragons, за неделю, 6
Europa Plus, PI_MI GENTE, BALVIN and WILLY WLILLIAM, за неделю, 1
Europa Plus, PI_HEAR ME NOW, ALOK/BRUNO MARTINI, за неделю, 2
Europa Plus, SLUCHAINAYA, LOBODA, за неделю, 1
Europa Plus, Boom Boom Boom (Gabry Ponte Edit), Indaqo, за неделю, 1
Europa Plus, SCARED TO BE LONELY, MARTIN GARRIX/DUA LIPA, за неделю, 2
Europa Plus, Take Me To Infinity, Consoul Trainin, за неделю, 1
Europa Plus, PI_SOMETHING JUST LIKE THIS, THE CHAINSMOKERS COLDPLAY, за неделю, 1
Europa Plus, Hymn For The Weekend, Coldplay, за неделю, 1
Europa Plus, SMALL TALK, FAKE_PICTURES, за неделю, 1
Europa Plus, PUMPED UP, Klingande, за неделю, 4
Europa Plus, Rockafeller Skank, Fatboy Slim, за неделю, 1
Europa Plus, Just Like Fire, Pink, за неделю, 3
Europa Plus, WE DONT TALK ANYMORE, CHARLIE PUTH/SELENA GOMES, за неделю, 1
Europa Plus, SUSPICION (GOING DEEPER REMIX), LP, за неделю, 2
Europa Plus, ECHAME LA CULPA, LUIS FONSI/DEMI LOVATO, за неделю, 8
Europa Plus, Lordly, Feder feat Alex Aiono, за неделю, 1
Europa Plus, I Don’t Wanna Live Forever (Fifty Shades Darker), ZAYN and Taylor Swift, за неделю, 1
Europa Plus, LIGHT IT UP (REMIX), MAJOR_LAZER/FUSE_ODG, за неделю, 1
Europa Plus, Adventure Of A Lifetime, Coldplay, за неделю, 1
Europa Plus, PI_HYMN FOR WEEKEND, Coldplay, за неделю, 1
Europa Plus, THIS GIRL, KUNGS/COOKIN_ON_3_BURNES, за неделю, 1
Europa Plus, Airplanes, BoB and Hayley Williams, за неделю, 1
Europa Plus, I Dont Want to Miss, Aerosmith, за неделю, 1
Europa Plus, Кружит, MONATIK, за неделю, 1
Europa Plus, Rich Boy, Galantis, за неделю, 2
Europa Plus, PI_HYMN FOR WEEKEND, Coldplay, за неделю, 2
Europa Plus, BOOK OF LOVE, FELIX JAEHN/POLINA, за неделю, 1
Europa Plus, The Monster, Eminem and Rihanna, за неделю, 1
Europa Plus, Sweet Harmony, Sans Souci feat Pearl Andersson, за неделю, 1
Europa Plus, Nana Song (ft Nina), Sherrie Sherrie and The Ware, за неделю, 5
Europa Plus, Waiting For The Summer, Deepend ft Graham Candy, за неделю, 4
Europa Plus, Hear Me Now, Alok Bruno Martini feat Zeeba, за неделю, 1
Europa Plus, The Road (Effective Radio Remix), Flying Decibels, за неделю, 2
Europa Plus, THE ROAD (EFFECTIVE RADIO REMIX), FLYING_DECIBELS, за неделю, 1
Europa Plus, PI_TAKE ME TO INFINITY, CONSOUL_TRAININ, за неделю, 1
Europa Plus, THE ROAD (EFFECTIVE RADIO REMIX), FLYING_DECIBELS, за неделю, 2
Europa Plus, If Theres Any Justice, Lemar, за неделю, 1
Europa Plus, Somebody That I Used To Know (Remix), Gotye feat Kimbra, за неделю, 1
Europa Plus, LOST ON YOU (SWANKY TUNES and GOING DEEPER REMIX), LP, за неделю, 2
Europa Plus, Kissing Strangers ft Nicki Minaj, DNCE, за неделю, 1
Europa Plus, BREATHE, Jax Jones, за неделю, 1
Europa Plus, Thunder, Imagine Dragons, за неделю, 3
Europa Plus, Thrift Shop, Macklemore and Ryan Lewis, за неделю, 1
Europa Plus, So Far Away, DAVID GUETTA;Jamie Scott;MARTIN GARRIX;Romy Dya, за неделю, 1
Europa Plus, SHTRIKHI+ID, BURITO, за неделю, 3
Europa Plus, Falling, Alesso, за неделю, 3
Europa Plus, Take Me To Infinity, Consoul Trainin, за неделю, 2
Europa Plus, Human, RagnBone Man, за неделю, 2
Europa Plus, PI_CHEAP THRILLS, SIA/SEAN PAUL, за неделю, 1
Europa Plus, YOU KNOW YOU LIKE IT, ALUNAGEORGE/DJ_SNAKE, за неделю, 1
Europa Plus, Could I have this kiss forever, Enrique Iglesias and Whitney Houston, за неделю, 1
Europa Plus, LA LOUZE, SHANGUY, за неделю, 3
Europa Plus, DEMONS, Imagine Dragons, за неделю, 1
Europa Plus, I Never Felt So Right, Ben Delay, за неделю, 1
Europa Plus, PI_TUESDAY, BURAK YETER, за неделю, 1
Europa Plus, OHLALA, MRDA-NOS, за неделю, 1
Europa Plus, HEROES, Alesso, за неделю, 2
Europa Plus, Улети, T-Fest, за неделю, 5
Europa Plus, DIRTY SEXY MONEY, DAVID GUETTA/AFROJACK/CHARLI_XCX, за неделю, 3
Europa Plus, Waiting For The Summer, Deepend ft Graham Candy, за неделю, 4
Europa Plus, Blow Your Mind (Mwah), Dua Lipa, за неделю, 1
Europa Plus, PI_HEAR ME NOW, ALOK/BRUNO MARTINI, за неделю, 1
Europa Plus, PI_KATCHI, OFENBACH/NICK WATERHOUSE, за неделю, 1
Europa Plus, ALONE, Alan Walker, за неделю, 1
Europa Plus, Animals, Martin Garrix, за неделю, 1
Europa Plus, La Louze, SHANGUY, за неделю, 1
Europa Plus, Whistle, Flo Rida, за неделю, 1
Europa Plus, Livin In A World Without You, The Rasmus, за неделю, 1
Europa Plus, Im Not The Only One, Sam Smith, за неделю, 1
Europa Plus, Sorry, Madonna, за неделю, 1
Europa Plus, MARIA MARIA, MARI FERRARI/MISS MARY, за неделю, 4
Europa Plus, Sous Loeil De Lange, K-Maro, за неделю, 1
Europa Plus, Way Down We Go, Kaleo, за неделю, 5
Europa Plus, SOFI TUKKER feat NERVO The Knocks and Alisa Ueno - Best Friend, Alisa Ueno;NERVO;Sofi Tukker;The Knocks, за неделю, 4
Europa Plus, Apologize, Timbaland and OneRepublic, за неделю, 1
Europa Plus, MI GENTE, J_BALVIN/WILLY WILLIAM, за неделю, 1
Europa Plus, TIRED BONES, LBONE/LAENZ, за неделю, 5
Europa Plus, IN THE MORNING, JADED, за неделю, 1
Europa Plus, TO LET MYSELF GO, THE_AVENER, за неделю, 1
Europa Plus, PI_HUMAN, RAGNBONE_MAN, за неделю, 1
Europa Plus, ECHAME LA CULPA, LUIS FONSI/DEMI LOVATO, за неделю, 2
Europa Plus, All Four Walls ft Vaults, Gorgon City, за неделю, 1
Europa Plus, Fallin, Playmen, за неделю, 1
Europa Plus, IMPULSI, ELENA TEMNIKOVA, за неделю, 1
Europa Plus, PI_BE MINE, OFENBACH, за неделю, 1
Europa Plus, PI_PRIVATE DANCER, JULIAN PERRETTA/FEDER, за неделю, 1
Europa Plus, PI_KATCHI, OFENBACH/NICK WATERHOUSE, за неделю, 3
Europa Plus, Case Depart, Team BS, за неделю, 1
Europa Plus, Tuesday ft Danelle Sandoval, Burak Yeter, за неделю, 1
Europa Plus, Single Lady, Dj Layla and Alissa, за неделю, 1
Europa Plus, I GOT LOVE, MIYAGI, за неделю, 2
Europa Plus, Stole The Show feat Parson James, Kygo, за неделю, 1
Europa Plus, BOOK OF LOVE, FELIX JAEHN/POLINA, за неделю, 1
Europa Plus, LOST ON YOU (SWANKY TUNES and GOING DEEPER REMIX), LP, за неделю, 1
Europa Plus, PI_SUB PIELA, CARLAS DREAMS, за неделю, 1
Europa Plus, SUSPICION (GOING DEEPER REMIX), LP, за неделю, 7
Europa Plus, Catch, Kosheen, за неделю, 1
Europa Plus, PI_SOMETHING JUST LIKE THIS, THE CHAINSMOKERS COLDPLAY, за неделю, 2
Europa Plus, (MUCHO MAMBO) SWAY, SHAFT, за неделю, 1
Europa Plus, Know My Love, Matt Nash, за неделю, 1
Europa Plus, PI_LORDLY, FEDER, за неделю, 1
Europa Plus, Fight Back With Love Tonight, Kush Kush, за неделю, 3
Europa Plus, IMAGINATION, GORGON_CITY, за неделю, 1
Europa Plus, Thunder, Imagine Dragons, за неделю, 2
Europa Plus, Kissing Strangers ft Nicki Minaj, DNCE, за неделю, 1
Europa Plus, Cant Hold Us, Macklemore and Ryan Lewis, за неделю, 1
Europa Plus, Shape Of You, Ed Sheeran, за неделю, 2
Europa Plus, I GOT LOVE, MIYAGI, за неделю, 2
Europa Plus, Money On My Mind, Sam Smith, за неделю, 1
Europa Plus, edit_WONDERFUL LIFE, HURTS, за неделю, 1
Europa Plus, ROZOVOE VINO, ELDJAY/FEDUK, за неделю, 4
Europa Plus, Umbrella, Rihanna, за неделю, 1
Europa Plus, When We Stand Together, Nickelback, за неделю, 1
Europa Plus, Can`t Get You Out Of My Head, Kylie Minogue, за неделю, 1
Europa Plus, Never Go Away, C-BooL, за неделю, 1
Europa Plus, TAK KRASIVO (REMIX), SERGEY LAZAREV, за неделю, 5
Europa Plus, Cola (Robin Schulz Remix), CamelPhat and Elderbrook, за неделю, 2
Europa Plus, Breathe (ft Ina Wroldsen), Jax Jones, за неделю, 2
Europa Plus, Boom Boom Boom (Gabry Ponte Edit), Indaqo, за неделю, 1
Europa Plus, Stereo Hearts, Gym Class Heroes feat Adam Levine, за неделю, 1
Europa Plus, LONELY TOGETHER (ALAN WARKER REMIX), AVICII/RITA ORA, за неделю, 1
Europa Plus, LA LOUZE, SHANGUY, за неделю, 2
Europa Plus, PAPAOUTAI, STROMAE, за неделю, 1
Europa Plus, Touch You Right Now, Basic Element, за неделю, 1
Europa Plus, Улети, T-Fest, за неделю, 6
Europa Plus, Walking On Air, Anise K and Snoop Dogg & Bella Blue, за неделю, 1
Europa Plus, LUSH LIFE, Zara Larsson, за неделю, 1
Europa Plus, Prayer In C, Lilly Wood and the Prick and Robin Schulz, за неделю, 1
Europa Plus, BOOK OF LOVE, FELIX JAEHN/POLINA, за неделю, 1
Europa Plus, The Hills, The Weeknd, за неделю, 1
Europa Plus, Breathe (ft Ina Wroldsen), Jax Jones, за неделю, 1
Europa Plus, HEROES, Alesso, за неделю, 1
Europa Plus, Nana Song (ft Nina), Sherrie Sherrie and The Ware, за неделю, 5
Europa Plus, Hot Right Now, Dj Fresh and Rita Ora, за неделю, 1
Europa Plus, Dusk Till Dawn ft Sia, ZAYN, за неделю, 6
Europa Plus, Heathens, Twenty One Pilots, за неделю, 1
Europa Plus, MIND IF I STAY (ASTERO REMIX), KADEBOSTANY, за неделю, 4
Europa Plus, Shape, Sugababes, за неделю, 1
Europa Plus, Unstoppable, Sia, за неделю, 1
Europa Plus, Too Close, Alex Clare, за неделю, 1
Europa Plus, LET ME LOVE YOU, DJ_SNAKE/JUSTIN BIEBER, за неделю, 1
Europa Plus, NEVER LET YOU GO, MOSIMANN/JOE CLEERE, за неделю, 8
Europa Plus, Say It Right, Nelly Furtado, за неделю, 1
Europa Plus, Believer, Imagine Dragons, за неделю, 1
Europa Plus, DISCO TITS, Tove Lo, за неделю, 1
Europa Plus, Fight Back With Love Tonight, Kush Kush, за неделю, 4
Europa Plus, Roulette, Katy Perry, за неделю, 2
Europa Plus, Rise Up, Thomas Jack and Jasmine Thompson, за неделю, 2
Europa Plus, Soledad, Westlife, за неделю, 1
Europa Plus, PUMPED UP, Klingande, за неделю, 5
Europa Plus, IN THE MORNING, JADED, за неделю, 4
Europa Plus, LONELY TOGETHER (ALAN WARKER REMIX), AVICII/RITA ORA, за неделю, 1
Europa Plus, Shes On My Mind, JP Cooper, за неделю, 2
Europa Plus, Sad Story (Out Of Luck), Merk and Kremont, за неделю, 7
Europa Plus, PI_TAKE ME TO INFINITY, CONSOUL_TRAININ, за неделю, 1
Europa Plus, THE OCEAN, MIKE PERRY, за неделю, 2
Europa Plus, PI_STARBOY, Weeknd, за неделю, 1
Europa Plus, Kissing Strangers ft Nicki Minaj, DNCE, за неделю, 1
Europa Plus, Stressed Out, Twenty One Pilots, за неделю, 2
Europa Plus, Океанами Стали, Alekseev, за неделю, 2
Europa Plus, Castle Walls, TI feat Christina Aguilera, за неделю, 1
Europa Plus, Believer, Imagine Dragons, за неделю, 1
Europa Plus, Rich Boy, Galantis, за неделю, 2
Europa Plus, If Everyone Cared, Nickelback, за неделю, 1
Europa Plus, NEVER LET YOU GO, MOSIMANN/JOE CLEERE, за неделю, 9
Europa Plus, Castle Walls, TI feat Christina Aguilera, за неделю, 1
Europa Plus, Falling, Alesso, за неделю, 2
Europa Plus, JAI CHERCHE, AMIR, за неделю, 1
Europa Plus, Roulette, Katy Perry, за неделю, 2
Europa Plus, PI_WAY DOWN WE GO, KALEO, за неделю, 3
Europa Plus, PI_WAY DOWN WE GO, KALEO, за неделю, 2
Europa Plus, PI_MI GENTE, BALVIN and WILLY WLILLIAM, за неделю, 1
Europa Plus, Young and Beautiful (Kevin Blanc remix), Lana Del Rey, за неделю, 1
Europa Plus, Radioactive, Imagine Dragons, за неделю, 1
Europa Plus, SHTRIKHI, BURITO, за неделю, 5
Europa Plus, Hurt, Christina Aguilera, за неделю, 1
Europa Plus, PI_TUESDAY, BURAK YETER, за неделю, 2
Europa Plus, BLIND HEART, CAZZETTE/TERRI_B!, за неделю, 1
Europa Plus, Оружие, Пицца, за неделю, 1
Europa Plus, Cupids Chokeholold, Gym Class Heroes, за неделю, 1
Europa Plus, The Magic Key, One-T and Cool-T, за неделю, 1
Europa Plus, LET ME LOVE YOU, DJ_SNAKE/JUSTIN BIEBER, за неделю, 1
Europa Plus, Be Mine, Ofenbach, за неделю, 1
Europa Plus, Hello, Adele, за неделю, 1
Europa Plus, Shes On My Mind, JP Cooper, за неделю, 2
Europa Plus, PI_ROULETTE, KATY PERRY, за неделю, 3
Europa Plus, Work from Home ft Ty Dolla $ign, Fifth Harmony, за неделю, 1
Europa Plus, Apologize, Timbaland and OneRepublic, за неделю, 1
Europa Plus, Feel Good Inc, Gorillaz, за неделю, 1
Europa Plus, Under, Alex Hepburn, за неделю, 1
Europa Plus, Nana Song (ft Nina), Sherrie Sherrie and The Ware, за неделю, 6
Europa Plus, GET LUCKY, DAFT_PUNK, за неделю, 1
Europa Plus, MARIA MARIA, MARI FERRARI/MISS MARY, за неделю, 4
Europa Plus, CALL ON ME, Starley, за неделю, 1
Europa Plus, PI_THIS GIRL, Kungs, за неделю, 1
Europa Plus, Stressed Out, Twenty One Pilots, за неделю, 1
Europa Plus, TELL ME WHO, VANOTEK/ENELI, за неделю, 3
Europa Plus, LOST ON YOU (SWANKY TUNES and GOING DEEPER REMIX), LP, за неделю, 1
Europa Plus, PI_HUMAN, RAGNBONE_MAN, за неделю, 1
Europa Plus, Неделимы, Artik and Asti, за неделю, 1
Europa Plus, Never Go Away, C-BooL, за неделю, 1
Europa Plus, Appelle Mon Numero, Mylene Farmer, за неделю, 1
Europa Plus, MIND IF I STAY (ASTERO REMIX), KADEBOSTANY, за неделю, 3
Europa Plus, Lonely Together ft Rita Ora (Alan Walker Remix), Avicii, за неделю, 2
Europa Plus, NO ROOTS, ALICE MERTON, за неделю, 5
Europa Plus, FIVE MORE HOURS, DEORRO, за неделю, 2
Europa Plus, PI_TAKE ME TO INFINITY, CONSOUL_TRAININ, за неделю, 1
Europa Plus, Sad Story (Out Of Luck), Merk and Kremont, за неделю, 7
Europa Plus, BLIND, FEDER/EMMI, за неделю, 1
Europa Plus, Under, Alex Hepburn, за неделю, 1
Europa Plus, IN TANGO, IN GRID, за неделю, 1
Europa Plus, If Today Was Your Last Day, Nickelback, за неделю, 1
Europa Plus, Unstoppable, Sia, за неделю, 1
Europa Plus, Small Talk, Fake Pictures and Tiger Park, за неделю, 2
Europa Plus, Lordly, Feder feat Alex Aiono, за неделю, 1
Europa Plus, Starboy ft Daft Punk, The Weeknd, за неделю, 3
Europa Plus, REALITY (CHRISTMAS MIX), LOST_FREQUENCIES, за неделю, 1
Europa Plus, Sad Story (Out Of Luck), Merk and Kremont, за неделю, 5
Europa Plus, PI_CHEAP THRILLS, SIA/SEAN PAUL, за неделю, 1
Europa Plus, Kissing Strangers ft Nicki Minaj, DNCE, за неделю, 2
Europa Plus, Chandelier, Sia, за неделю, 1
Europa Plus, Cant Hold Us, Macklemore and Ryan Lewis, за неделю, 1
Europa Plus, Take Me To Church (remix), Hozier, за неделю, 1
Europa Plus, SLUCHAINAYA, LOBODA, за неделю, 1
Europa Plus, Disco Tits, Tove Lo, за неделю, 1
Europa Plus, Kiss Me, Sixpence None The Richer, за неделю, 1
Europa Plus, DISCO TITS, Tove Lo, за неделю, 1
Europa Plus, PUMPED UP, Klingande, за неделю, 6
Europa Plus, WE DONT TALK ANYMORE, CHARLIE PUTH/SELENA GOMES, за неделю, 1
Europa Plus, PI_TUESDAY, BURAK YETER, за неделю, 2
Europa Plus, Changes, Faul and Wad Ad vs Pnau, за неделю, 1
Europa Plus, PI_DONT LET ME DOWN, The Chainsmokers, за неделю, 1
Europa Plus, OK, ROBIN SCHULZ/JAMES BLUNT, за неделю, 1
Europa Plus, FIVE MORE HOURS, DEORRO/CHRIS BROWN, за неделю, 1
Europa Plus, Attention, Charlie Puth, за неделю, 2
Europa Plus, PI_ROULETTE, KATY PERRY, за неделю, 3
Europa Plus, I GOT LOVE, MIYAGI, за неделю, 2
Europa Plus, Papaoutai, Stromae, за неделю, 1
Europa Plus, MORE THAN YOU KNOW, AXWELL_and_INGROSOO, за неделю, 2
Europa Plus, Thrift Shop, Macklemore and Ryan Lewis, за неделю, 1
Europa Plus, I Follow Rivers, Lykke Li, за неделю, 1
Europa Plus, THE OCEAN, MIKE PERRY, за неделю, 2
Europa Plus, Beautiful Liar, BEYONCE and SHAKIRA, за неделю, 1
