Europa Plus, The Monster, Eminem and Rihanna, за неделю, 1
Europa Plus, Radioactive, Imagine Dragons, за неделю, 1
Europa Plus, Im Not The Only One, Sam Smith, за неделю, 1
Europa Plus, Beggin, Madcon, за неделю, 1
Europa Plus, MIND IF I STAY (ASTERO REMIX), KADEBOSTANY, за неделю, 2
Europa Plus, MARIA MARIA, MARI FERRARI/MISS MARY, за неделю, 5
Europa Plus, Work from Home ft Ty Dolla $ign, Fifth Harmony, за неделю, 2
Europa Plus, How Deep Is Your Love, Calvin Harris and Disciples, за неделю, 1
Europa Plus, Wake Me Up, Avicii and Aloe Blacc, за неделю, 1
Europa Plus, rockstar, Post Malone feat 21 Savage, за неделю, 8
Europa Plus, WHATEVER IT TAKES, Imagine Dragons, за неделю, 8
Europa Plus, If Today Was Your Last Day, Nickelback, за неделю, 1
Europa Plus, PI_STARBOY, Weeknd, за неделю, 1
Europa Plus, Ride It, Jay Sean, за неделю, 1
Europa Plus, FEEL YOU, NABBOO/MISHA MILLER, за неделю, 1
Europa Plus, U + Ur Hand, Pink, за неделю, 1
Europa Plus, Sweet Harmony, Sans Souci feat Pearl Andersson, за неделю, 2
Europa Plus, Вдох, Елена Темникова, за неделю, 2
Europa Plus, YA OBESHAYU, NASTYA KUDRI/ALEXEY VOROBYEV, за неделю, 2
Europa Plus, PI_DUSK TILL DAWN, ZAYN/SIA, за неделю, 2
Europa Plus, SUPERGIRL, ANNA NAKLAB/ALLE FARBEN, за неделю, 1
Europa Plus, IGNITE, MICHAEL_MIND_PROJECT, за неделю, 1
Europa Plus, CALL ON ME, Starley, за неделю, 2
Europa Plus, I HATE YOU I LOVE YOU, GNASH, за неделю, 1
Europa Plus, Something Just Like This, The Chainsmokers and Coldplay, за неделю, 1
Europa Plus, Insatiable, Darren Hayes, за неделю, 1
Europa Plus, All Four Walls ft Vaults, Gorgon City, за неделю, 1
Europa Plus, KATCHI, OFENBACH/NICK WATERHOUSE, за неделю, 7
Europa Plus, Кружит, MONATIK, за неделю, 2
Europa Plus, Feel It Still, Portugal The Man, за неделю, 2
Europa Plus, Rich Boy, Galantis, за неделю, 1
Europa Plus, Umbrella, Rihanna, за неделю, 1
Europa Plus, Dirty Sexy Money feat Charli XCX and French Montana, David Guetta and Afrojack, за неделю, 1
Europa Plus, Now And Later, Sage The Gemini, за неделю, 1
Europa Plus, Be Mine, Ofenbach, за неделю, 1
Europa Plus, Stolen Dance, Milky Chance, за неделю, 1
Europa Plus, On My Way ft Bright Sparks, Tiesto, за неделю, 1
Europa Plus, Proper education, Eric Prydz, за неделю, 1
Europa Plus, NEW RULES, Dua Lipa, за неделю, 5
Europa Plus, Rolling In The Deep, Adele, за неделю, 1
Europa Plus, You Are The Only One, Сергей Лазарев, за неделю, 1
Europa Plus, PI_OCEAN DRIVE, Duke Dumont, за неделю, 1
Europa Plus, You Are The Only One, Сергей Лазарев, за неделю, 1
Europa Plus, Where Is The Love (Radio Edit), BLACK EYED PEAS, за неделю, 1
Europa Plus, COOL GIRL, Tove Lo, за неделю, 1
Europa Plus, SMALL TALK, FAKE_PICTURES, за неделю, 2
Europa Plus, Safe and Sound, Capital Cities, за неделю, 1
Europa Plus, King, Years and Years, за неделю, 1
Europa Plus, YOURE MINE (DJ ANTONIO and ASTERO REMIX), RAVING GEORGE, за неделю, 1
Europa Plus, MORE THAN YOU KNOW, AXWELL_and_INGROSOO, за неделю, 2
Europa Plus, PI_CHEAP THRILLS, SIA/SEAN PAUL, за неделю, 1
Europa Plus, PI_LORDLY, FEDER, за неделю, 2
Europa Plus, УВЛИУВТ, MONATIK, за неделю, 1
Europa Plus, Blow Your Mind (Mwah), Dua Lipa, за неделю, 1
Europa Plus, THE ROAD (EFFECTIVE RADIO REMIX), FLYING_DECIBELS, за неделю, 4
Europa Plus, KING, YEARS_and_YEARS, за неделю, 1
Europa Plus, DIRTY SEXY MONEY, DAVID GUETTA/AFROJACK/CHARLI_XCX, за неделю, 9
Europa Plus, Dusk Till Dawn ft Sia, ZAYN, за неделю, 6
Europa Plus, ROZOVOE VINO, ELDJAY/FEDUK, за неделю, 4
Europa Plus, I Don’t Wanna Live Forever (Fifty Shades Darker), ZAYN and Taylor Swift, за неделю, 1
Europa Plus, All The Right Moves, OneRepublic, за неделю, 1
Europa Plus, Heathens, Twenty One Pilots, за неделю, 1
Europa Plus, WE DONT TALK ANYMORE, CHARLIE PUTH/SELENA GOMES, за неделю, 1
Europa Plus, PI_SUB PIELA, CARLAS DREAMS, за неделю, 1
Europa Plus, Feel It Still, Portugal The Man, за неделю, 1
Europa Plus, Неделимы, Artik and Asti, за неделю, 1
Europa Plus, BOOM BOOM BOOM (GABRY PONTE REMIX), INDAQO, за неделю, 1
Europa Plus, Disco Tits, Tove Lo, за неделю, 2
Europa Plus, I Dont Wanna Know, Mario Winnans and Enya, за неделю, 1
Europa Plus, Hear Me Now, Alok Bruno Martini feat Zeeba, за неделю, 1
Europa Plus, Hurt, Christina Aguilera, за неделю, 1
Europa Plus, Euphoria, Loreen, за неделю, 1
Europa Plus, WALKING ON AIR, ANISE_K/SNOOP DOGG, за неделю, 1
Europa Plus, PI_SHAPE OF YOU, Ed Sheeran, за неделю, 1
Europa Plus, La Cancion, Tim3bomb, за неделю, 3
Europa Plus, UNBREAK MY HEART, TONI BRAXTON, за неделю, 1
Europa Plus, IN THE MORNING, JADED, за неделю, 4
Europa Plus, Something Just Like This, The Chainsmokers and Coldplay, за неделю, 1
Europa Plus, Angels, Morandi, за неделю, 1
Europa Plus, Dusk Till Dawn ft Sia, ZAYN, за неделю, 6
Europa Plus, BLIND HEART, CAZZETTE/TERRI_B!, за неделю, 1
Europa Plus, TIRED BONES, LBONE/LAENZ, за неделю, 5
Europa Plus, NEVER LET YOU GO, MOSIMANN/JOE CLEERE, за неделю, 9
Europa Plus, Ignite, Michael Mind Project, за неделю, 1
Europa Plus, edit_WONDERFUL LIFE, HURTS, за неделю, 1
Europa Plus, SandM, Rihanna, за неделю, 1
Europa Plus, Written In The Stars, Tinie Tempah, за неделю, 1
Europa Plus, KATCHI, OFENBACH/NICK WATERHOUSE, за неделю, 5
Europa Plus, Fight Back With Love Tonight, Kush Kush, за неделю, 2
Europa Plus, PUMPED UP, Klingande, за неделю, 5
Europa Plus, Love The Way You Lie, Eminem and Rihanna, за неделю, 1
Europa Plus, Blame, Calvin Harris and John Newman, за неделю, 1
Europa Plus, Find a way, J-five, за неделю, 1
Europa Plus, PI_TUESDAY, BURAK YETER, за неделю, 1
Europa Plus, PI_DUSK TILL DAWN, ZAYN/SIA, за неделю, 2
Europa Plus, DONT LET ME GO (REMIX), KANITA, за неделю, 2
Europa Plus, Freaky Like Me, Madcon, за неделю, 1
Europa Plus, OHLALA, MRDA-NOS, за неделю, 1
Europa Plus, MI GENTE, J_BALVIN/WILLY WILLIAM, за неделю, 1
Europa Plus, edit_SHUT UP, BLACK EYED PEAS, за неделю, 1
Europa Plus, COOL GIRL, Tove Lo, за неделю, 1
Europa Plus, Ocean Drive (Michael Calfan Remix), Duke Dumont, за неделю, 1
Europa Plus, MI GENTE, J_BALVIN/WILLY WILLIAM, за неделю, 2
Europa Plus, GET UGLY, JASON DERULO, за неделю, 1
Europa Plus, PAPAOUTAI, STROMAE, за неделю, 1
Europa Plus, Cupids Chokeholold, Gym Class Heroes, за неделю, 1
Europa Plus, Family Portrait, Pink, за неделю, 1
Europa Plus, La La La, Naughty Boy and Sam Smith, за неделю, 1
Europa Plus, Ain’t Nobody (Loves Me Better), Felix Jaehn and Jasmine Thompson, за неделю, 1
Europa Plus, Colours, Morandi, за неделю, 1
Europa Plus, PI_ROULETTE, KATY PERRY, за неделю, 3
Europa Plus, KATCHI, OFENBACH/NICK WATERHOUSE, за неделю, 7
Europa Plus, NO ROOTS, ALICE MERTON, за неделю, 5
Europa Plus, TELL ME WHO, VANOTEK/ENELI, за неделю, 3
Europa Plus, SUGAR, ROBIN SCHULZ/FRANCESCO YATES, за неделю, 1
Europa Plus, THE ROAD (EFFECTIVE RADIO REMIX), FLYING_DECIBELS, за неделю, 4
Europa Plus, SOFI TUKKER feat NERVO The Knocks and Alisa Ueno - Best Friend, Alisa Ueno;NERVO;Sofi Tukker;The Knocks, за неделю, 7
Europa Plus, PI_WAY DOWN WE GO, KALEO, за неделю, 1
Europa Plus, La Louze, SHANGUY, за неделю, 2
Europa Plus, IMPULSI, ELENA TEMNIKOVA, за неделю, 2
Europa Plus, MI GENTE, J_BALVIN/WILLY WILLIAM, за неделю, 3
Europa Plus, PI_TAKE ME TO INFINITY, CONSOUL_TRAININ, за неделю, 2
Europa Plus, La Cancion, Tim3bomb, за неделю, 2
Europa Plus, Cake By The Ocean, DNCE, за неделю, 1
Europa Plus, What Goes Around…Comes Around, Justin Timberlake, за неделю, 1
Europa Plus, Love Me Again, John Newman, за неделю, 1
Europa Plus, PI_SOMETHING JUST LIKE THIS, THE CHAINSMOKERS COLDPLAY, за неделю, 1
Europa Plus, PI_BELIEVER, Imagine Dragons, за неделю, 1
Europa Plus, Addicted, Serge Devant and Hadley, за неделю, 2
Europa Plus, Кружит, MONATIK, за неделю, 2
Europa Plus, Hear Me Now, Alok Bruno Martini feat Zeeba, за неделю, 1
Europa Plus, La Cancion, Tim3bomb, за неделю, 3
Europa Plus, Say It Right, Nelly Furtado, за неделю, 1
Europa Plus, PI_TUESDAY, BURAK YETER, за неделю, 1
Europa Plus, You Spin Me Round, Danzel, за неделю, 1
Europa Plus, Changes, Faul and Wad Ad vs Pnau, за неделю, 1
Europa Plus, Lady (Hear Me Tonight), Modjo, за неделю, 1
Europa Plus, IMPULSI, ELENA TEMNIKOVA, за неделю, 2
Europa Plus, Stole The Show feat Parson James, Kygo, за неделю, 1
Europa Plus, Starboy ft Daft Punk, The Weeknd, за неделю, 1
Europa Plus, BOOK OF LOVE, FELIX JAEHN/POLINA, за неделю, 1
Europa Plus, Written In The Stars, Tinie Tempah, за неделю, 1
Europa Plus, Scream and Shout, William and Britney Spears, за неделю, 1
Europa Plus, PI_HEAR ME NOW, ALOK/BRUNO MARTINI, за неделю, 1
Europa Plus, Lonely Together ft Rita Ora (Alan Walker Remix), Avicii, за неделю, 3
Europa Plus, Appelle Mon Numero, Mylene Farmer, за неделю, 1
Europa Plus, Single Lady, Dj Layla and Alissa, за неделю, 1
Europa Plus, Just Like Fire, Pink, за неделю, 2
Europa Plus, PI_SUCKER FOR PAIN, LIL WAYNE IMAGINE DRAGONS, за неделю, 1
Europa Plus, PAPAOUTAI, STROMAE, за неделю, 1
Europa Plus, Cheap Thrills (feat Sean Paul), Sia, за неделю, 1
Europa Plus, WHATAYA WANT FROM ME, ADAM LAMBERT, за неделю, 1
Europa Plus, Cry Baby, Paloma Faith, за неделю, 1
Europa Plus, Heathens, Twenty One Pilots, за неделю, 1
Europa Plus, Every Single Day, Benassi bros / Dhany, за неделю, 1
Europa Plus, SWISH SWISH, KATY PERRY/NICKI MINAJ, за неделю, 1
Europa Plus, Addicted, Serge Devant and Hadley, за неделю, 1
Europa Plus, JAI CHERCHE, AMIR, за неделю, 1
Europa Plus, Small Talk, Fake Pictures and Tiger Park, за неделю, 2
Europa Plus, Thunder, Imagine Dragons, за неделю, 1
Europa Plus, KING, YEARS_and_YEARS, за неделю, 1
Europa Plus, Under, Alex Hepburn, за неделю, 1
Europa Plus, TEDDY BEAR (ASTERO REMIX), KADEBOSTANY, за неделю, 1
Europa Plus, I HATE YOU I LOVE YOU, GNASH, за неделю, 2
Europa Plus, ALONE, Alan Walker, за неделю, 1
Europa Plus, SCARED TO BE LONELY, MARTIN GARRIX/DUA LIPA, за неделю, 1
Europa Plus, rockstar, Post Malone feat 21 Savage, за неделю, 8
Europa Plus, ARE YOU WITH ME (CHRISTMAS MIX), LOST_FREQUENCIES, за неделю, 1
Europa Plus, River Flows In You, Jasper Forks, за неделю, 1
Europa Plus, Ghost Town, Adam Lambert, за неделю, 1
Europa Plus, Happy Birthday, Flipsyde, за неделю, 1
Europa Plus, YOURE MINE (DJ ANTONIO and ASTERO REMIX), RAVING GEORGE, за неделю, 2
Europa Plus, SOFI TUKKER feat NERVO The Knocks and Alisa Ueno - Best Friend, Alisa Ueno;NERVO;Sofi Tukker;The Knocks, за неделю, 10
Europa Plus, DIRTY SEXY MONEY, DAVID GUETTA/AFROJACK/CHARLI_XCX, за неделю, 8
Europa Plus, Falling, Alesso, за неделю, 3
Europa Plus, rockstar, Post Malone feat 21 Savage, за неделю, 7
Europa Plus, Улети, T-Fest, за неделю, 5
Europa Plus, SUSPICION (GOING DEEPER REMIX), LP, за неделю, 9
Europa Plus, PI_HUMAN, RAGNBONE_MAN, за неделю, 2
Europa Plus, MARIA MARIA, MARI FERRARI/MISS MARY, за неделю, 4
Europa Plus, CLOSER (REMIX), NE-YO, за неделю, 1
Europa Plus, MIND IF I STAY (ASTERO REMIX), KADEBOSTANY, за неделю, 2
Europa Plus, CALL ON ME, Starley, за неделю, 2
Europa Plus, I Know What You Want, Busta Rhymes and Mariah Carey, за неделю, 1
Europa Plus, Kiss, Serebro, за неделю, 1
Europa Plus, Rise Up, Thomas Jack and Jasmine Thompson, за неделю, 1
Europa Plus, PI_HUMAN, RAGNBONE_MAN, за неделю, 1
Europa Plus, Hymn For The Weekend, Coldplay, за неделю, 2
Europa Plus, Hymn For The Weekend, Coldplay, за неделю, 2
Europa Plus, California Dreamin, Royal Gigolos, за неделю, 1
Europa Plus, Prayer In C, Lilly Wood and the Prick and Robin Schulz, за неделю, 1
Europa Plus, LET’S GO, K-Maro, за неделю, 1
Europa Plus, La Cancion, Tim3bomb, за неделю, 3
Europa Plus, Lordly, Feder feat Alex Aiono, за неделю, 1
Europa Plus, Paparazzi, Lady Gaga, за неделю, 1
Europa Plus, BEST FRIEND, SOFI TUKKER/NERVO, за неделю, 1
Europa Plus, Tuesday ft Danelle Sandoval, Burak Yeter, за неделю, 1
Europa Plus, SWISH SWISH, KATY PERRY/NICKI MINAJ, за неделю, 1
Europa Plus, Till The End, Swanky Tunes and Going Deeper, за неделю, 2
Europa Plus, Single Lady, Dj Layla and Alissa, за неделю, 1
Europa Plus, Take Me To Infinity, Consoul Trainin, за неделю, 1
Europa Plus, LOST ON YOU (SWANKY TUNES and GOING DEEPER REMIX), LP, за неделю, 1
Europa Plus, Boom Boom Boom (Gabry Ponte Edit), Indaqo, за неделю, 1
Europa Plus, Вдох, Елена Темникова, за неделю, 1
Europa Plus, GET UGLY, JASON DERULO, за неделю, 1
Europa Plus, MORE THAN YOU KNOW, AXWELL_and_INGROSOO, за неделю, 3
Europa Plus, WORTH IT, Fifth Harmony, за неделю, 1
Europa Plus, Love The Way You Lie, Eminem and Rihanna, за неделю, 1
Europa Plus, edit_STEREO HEARTS, GYM CLASS HEROES/ADAM LEVINE, за неделю, 1
Europa Plus, Endless Summer, Oceana, за неделю, 1
Europa Plus, LA LOUZE, SHANGUY, за неделю, 3
Europa Plus, I Don’t Wanna Live Forever (Fifty Shades Darker), ZAYN and Taylor Swift, за неделю, 1
Europa Plus, Imagination, Gorgon City feat Katy Menditta, за неделю, 1
Europa Plus, The Greatest, Sia feat Kendrick Lamar, за неделю, 1
Europa Plus, Bonfire (feat Alma), Felix Jaehn, за неделю, 1
Europa Plus, Way Down We Go, Kaleo, за неделю, 7
Europa Plus, YOURE MINE (DJ ANTONIO and ASTERO REMIX), RAVING GEORGE, за неделю, 1
Europa Plus, ECHAME LA CULPA, LUIS FONSI/DEMI LOVATO, за неделю, 1
Europa Plus, BLIND HEART, CAZZETTE/TERRI_B!, за неделю, 2
Europa Plus, Кружит, MONATIK, за неделю, 1
Europa Plus, OHLALA, MRDA-NOS, за неделю, 2
Europa Plus, I Follow Rivers, Lykke Li, за неделю, 1
Europa Plus, Туманы, Макс Барских, за неделю, 2
Europa Plus, Somebody That I Used To Know (Remix), Gotye feat Kimbra, за неделю, 1
Europa Plus, I Remember The Time, Nana, за неделю, 1
Europa Plus, First Day, Timo Maas / Brian Molko, за неделю, 1
Europa Plus, In Your Eyes, Kylie Minogue, за неделю, 1
Europa Plus, DONT LET ME GO (REMIX), KANITA, за неделю, 1
Europa Plus, ALONE, Alan Walker, за неделю, 1
Europa Plus, Cheap Thrills (feat Sean Paul), Sia, за неделю, 1
Europa Plus, Stan, Eminem Feat Dido, за неделю, 1
Europa Plus, ROZOVOE VINO, ELDJAY/FEDUK, за неделю, 4
Europa Plus, NEW RULES, Dua Lipa, за неделю, 5
Europa Plus, The Greatest, Sia feat Kendrick Lamar, за неделю, 1
Europa Plus, All Four Walls ft Vaults, Gorgon City, за неделю, 2
Europa Plus, Save Me, Morandi, за неделю, 1
Europa Plus, Dont Stop The Music, Rihanna, за неделю, 1
Europa Plus, Hot Right Now, Dj Fresh and Rita Ora, за неделю, 1
Europa Plus, Work from Home ft Ty Dolla $ign, Fifth Harmony, за неделю, 1
Europa Plus, Waiting For The Summer, Deepend ft Graham Candy, за неделю, 5
Europa Plus, Rolling In The Deep, Adele, за неделю, 1
Europa Plus, Attention, Charlie Puth, за неделю, 3
Europa Plus, WICKED GAMES, PARRA_FOR_CUVA/ANNA NAKLAB, за неделю, 1
Europa Plus, PI_THIS GIRL, Kungs, за неделю, 1
Europa Plus, Stressed Out, Twenty One Pilots, за неделю, 2
Europa Plus, OHLALA, MRDA-NOS, за неделю, 2
Europa Plus, SHTRIKHI, BURITO, за неделю, 6
Europa Plus, IMPULSI, ELENA TEMNIKOVA, за неделю, 2
Europa Plus, The Hills, The Weeknd, за неделю, 1
Europa Plus, Shes On My Mind, JP Cooper, за неделю, 3
Europa Plus, The Monster, Eminem and Rihanna, за неделю, 1
Europa Plus, Sucker for Pain, Lil Wayne Wiz Khalifa and Imagine Dragons, за неделю, 2
Europa Plus, PI_BE MINE, OFENBACH, за неделю, 1
Europa Plus, Believer, Imagine Dragons, за неделю, 1
Europa Plus, YA OBESHAYU, NASTYA KUDRI/ALEXEY VOROBYEV, за неделю, 2
Europa Plus, Lets Get It Started, Black Eyed Peas, за неделю, 1
Europa Plus, If Everyone Cared, Nickelback, за неделю, 1
Europa Plus, Scream and Shout, William and Britney Spears, за неделю, 1
Europa Plus, WAKE ME UP, AVICII, за неделю, 1
Europa Plus, LET’S GO, K-Maro, за неделю, 1
Europa Plus, SUGAR, ROBIN SCHULZ/FRANCESCO YATES, за неделю, 1
Europa Plus, Face ALa Mer, Calogero / Passi, за неделю, 1
Europa Plus, Blow Your Mind (Mwah), Dua Lipa, за неделю, 1
Europa Plus, WE DONT TALK ANYMORE, CHARLIE PUTH/SELENA GOMES, за неделю, 1
Europa Plus, La Louze, SHANGUY, за неделю, 1
Europa Plus, Waiting For The Summer, Deepend ft Graham Candy, за неделю, 5
Europa Plus, You Dont Know Me ft RAYE, Jax Jones, за неделю, 1
Europa Plus, Waiting For The Summer, Deepend ft Graham Candy, за неделю, 8
Europa Plus, JAI CHERCHE, AMIR, за неделю, 1
Europa Plus, К черту любовь, Loboda, за неделю, 1
Europa Plus, Case Depart, Team BS, за неделю, 1
Europa Plus, WHATEVER IT TAKES, Imagine Dragons, за неделю, 8
Europa Plus, Ride It, Jay Sean, за неделю, 1
Europa Plus, BLIND HEART, CAZZETTE/TERRI_B!, за неделю, 1
Europa Plus, Sweet Harmony, Sans Souci feat Pearl Andersson, за неделю, 2
Europa Plus, Океанами Стали, Alekseev, за неделю, 2
Europa Plus, I Feel It Coming ft Daft Punk, The Weeknd, за неделю, 1
Europa Plus, Shes On My Mind, JP Cooper, за неделю, 3
Europa Plus, PI_DUSK TILL DAWN, ZAYN/SIA, за неделю, 2
Europa Plus, Heathens, Twenty One Pilots, за неделю, 3
Europa Plus, PI_BELIEVER, Imagine Dragons, за неделю, 1
Europa Plus, WAKE ME UP, AVICII, за неделю, 1
Europa Plus, If I Lose Myself (Remix), Alesso Vs OneRepublic, за неделю, 1
Europa Plus, Stressed Out, Twenty One Pilots, за неделю, 2
Europa Plus, Неделимы, Artik and Asti, за неделю, 1
Europa Plus, FEEL YOU, NABBOO/MISHA MILLER, за неделю, 1
Europa Plus, DONT LET ME DOWN, THE_CHAINSMOKERS, за неделю, 2
Europa Plus, WALK, KWABS, за неделю, 1
Europa Plus, PI_MI GENTE, BALVIN and WILLY WLILLIAM, за неделю, 1
Europa Plus, Angels, Morandi, за неделю, 1
Europa Plus, I Know What You Want, Busta Rhymes and Mariah Carey, за неделю, 1
Europa Plus, Hymn For The Weekend, Coldplay, за неделю, 1
Europa Plus, YOU KNOW YOU LIKE IT, ALUNAGEORGE/DJ_SNAKE, за неделю, 1
Europa Plus, WAY DOWN WE GO (REMIX), KALEO, за неделю, 1
Europa Plus, Оружие, Пицца, за неделю, 1
Europa Plus, Lets Get It Started, Black Eyed Peas, за неделю, 1
Europa Plus, CRAZY, GNARLS_BARKLEY, за неделю, 1
Europa Plus, BOOM BOOM BOOM (GABRY PONTE REMIX), INDAQO, за неделю, 1
Europa Plus, Beautiful Liar, BEYONCE and SHAKIRA, за неделю, 1
Europa Plus, Till The End, Swanky Tunes and Going Deeper, за неделю, 1
Europa Plus, Every Single Day, Benassi bros / Dhany, за неделю, 1
Europa Plus, LA LOUZE, SHANGUY, за неделю, 2
Europa Plus, GET UGLY, JASON DERULO, за неделю, 2
Europa Plus, I Never Felt So Right, Ben Delay, за неделю, 1
Europa Plus, Let Go, Paul Van Dyk, за неделю, 1
Europa Plus, OHLALA, MRDA-NOS, за неделю, 2
Europa Plus, LONELY TOGETHER (ALAN WARKER REMIX), AVICII/RITA ORA, за неделю, 1
Europa Plus, Its My Life, Bon Jovi, за неделю, 1
Europa Plus, Human, RagnBone Man, за неделю, 1
Europa Plus, SLUCHAINAYA, LOBODA, за неделю, 1
Europa Plus, Never Be the Same Again, Melanie C / Lisa Left Eye Lopez, за неделю, 1
Europa Plus, Blurred Lines, Robin Thicke and TI & Pharrell, за неделю, 1
Europa Plus, PI_BELIEVER, Imagine Dragons, за неделю, 1
Europa Plus, Where’d You Go, Fort Minor, за неделю, 1
Europa Plus, Way Down We Go, Kaleo, за неделю, 4
Europa Plus, Changing, Sigma feat Paloma Faith, за неделю, 1
Europa Plus, LYING IN THE SUN, PALASTIC/BRIGHT SPARKS, за неделю, 1
Europa Plus, MORE THAN YOU KNOW, AXWELL_and_INGROSOO, за неделю, 3
Europa Plus, WHATEVER IT TAKES, Imagine Dragons, за неделю, 8
Europa Plus, Вдох, Елена Темникова, за неделю, 1
Europa Plus, UPTOWN FUNK, MARC RONSON/BRUNO MARS, за неделю, 1
Europa Plus, Toxic, Britney Spears, за неделю, 1
Europa Plus, SAD STORY, MERK_and_KREMONT, за неделю, 1
Europa Plus, I BELONG TO YOU, LENNY KRAVITZ, за неделю, 1
Europa Plus, PI_SOMETHING JUST LIKE THIS, THE CHAINSMOKERS COLDPLAY, за неделю, 2
Europa Plus, Black Black Heart, David Usher, за неделю, 1
Europa Plus, Breathe (ft Ina Wroldsen), Jax Jones, за неделю, 1
Europa Plus, Океанами Стали, Alekseev, за неделю, 1
Europa Plus, PI_HEAR ME NOW, ALOK/BRUNO MARTINI, за неделю, 1
Europa Plus, All The Right Moves, OneRepublic, за неделю, 1
Europa Plus, HEROES, Alesso, за неделю, 1
Europa Plus, Многоэтажки, 5sta Family, за неделю, 1
Europa Plus, PI_ROULETTE, KATY PERRY, за неделю, 2
Europa Plus, Fearing Love, Serge Devant and Damiano feat Camille Safiya, за неделю, 1
Europa Plus, Rolling In The Deep, Adele, за неделю, 1
Europa Plus, THE OCEAN, MIKE PERRY, за неделю, 2
Europa Plus, Attention, Charlie Puth, за неделю, 3
Europa Plus, Apologize, Timbaland and OneRepublic, за неделю, 1
Europa Plus, WAY DOWN WE GO (REMIX), KALEO, за неделю, 2
Europa Plus, Hear Me Now, Alok Bruno Martini feat Zeeba, за неделю, 1
Europa Plus, PI_KATCHI, OFENBACH/NICK WATERHOUSE, за неделю, 1
Europa Plus, ROZOVOE VINO, ELDJAY/FEDUK, за неделю, 4
Europa Plus, Appelle Mon Numero, Mylene Farmer, за неделю, 1
Europa Plus, BOOM BOOM BOOM (GABRY PONTE REMIX), INDAQO, за неделю, 1
Europa Plus, Mind if I Stay (Astero mix), Kadebostany, за неделю, 1
Europa Plus, What  I’ve Done, Linkin Park, за неделю, 1
Europa Plus, Diamonds, Rihanna, за неделю, 1
Europa Plus, PI_HYMN FOR WEEKEND, Coldplay, за неделю, 1
Europa Plus, If Today Was Your Last Day, Nickelback, за неделю, 1
Europa Plus, DONT LET ME GO (REMIX), KANITA, за неделю, 1
Europa Plus, К черту любовь, Loboda, за неделю, 1
Europa Plus, I Knew You Were Trouble, Taylor Swift, за неделю, 1
Europa Plus, Sad Story (Out Of Luck), Merk and Kremont, за неделю, 8
Europa Plus, Torn, Natalie Imbruglia, за неделю, 1
Europa Plus, Disco Tits, Tove Lo, за неделю, 2
Europa Plus, La La La, Naughty Boy and Sam Smith, за неделю, 1
Europa Plus, KING, YEARS_and_YEARS, за неделю, 1
Europa Plus, Kiss Me, Sixpence None The Richer, за неделю, 1
Europa Plus, NO ROOTS, ALICE MERTON, за неделю, 5
Europa Plus, I Like It, Narcotic Thrust, за неделю, 1
Europa Plus, Say It Right, Nelly Furtado, за неделю, 1
Europa Plus, Kissing Strangers ft Nicki Minaj, DNCE, за неделю, 2
Europa Plus, Échame La Culpa, Luis Fonsi Demi Lovato, за неделю, 1
Europa Plus, Big City Life, Mattafix, за неделю, 1
Europa Plus, FEEL YOU, NABBOO/MISHA MILLER, за неделю, 1
Europa Plus, In The Morning, Jaded, за неделю, 1
Europa Plus, Loca People, Sak Noel, за неделю, 1
Europa Plus, Just Like Fire, Pink, за неделю, 1
Europa Plus, If Everyone Cared, Nickelback, за неделю, 1
Europa Plus, Believer, Imagine Dragons, за неделю, 1
Europa Plus, NEVER LET YOU GO, MOSIMANN/JOE CLEERE, за неделю, 8
Europa Plus, Summer, Calvin Harris, за неделю, 1
Europa Plus, Love The Way You Lie, Eminem and Rihanna, за неделю, 1
Europa Plus, If Theres Any Justice, Lemar, за неделю, 1
Europa Plus, Adventure Of A Lifetime, Coldplay, за неделю, 1
Europa Plus, Rise Up, Thomas Jack and Jasmine Thompson, за неделю, 1
Europa Plus, Human, RagnBone Man, за неделю, 1
Europa Plus, Lonely Together ft Rita Ora (Alan Walker Remix), Avicii, за неделю, 1
Europa Plus, Breathe (ft Ina Wroldsen), Jax Jones, за неделю, 2
Europa Plus, THE OCEAN, MIKE PERRY, за неделю, 1
Europa Plus, Dangerous, David Guetta feat Sam Martin, за неделю, 1
Europa Plus, Whistle, Flo Rida, за неделю, 1
Europa Plus, Shape Of You, Ed Sheeran, за неделю, 2
Europa Plus, Uhn Tiss Uhn Tiss Uhn Tiss, Bloodhound Gang, за неделю, 1
